index,sector,longBusinessSummary,country,shortName,symbol,trailingEps,forwardPE,marketCap,dividendYield,trailingPE,position_weight,target_allocation,current_price,quantity,order_quantity,rounding_loss
3,Healthcare,"AbbVie Inc. discovers, develops, manufactures, and sells pharmaceuticals in the worldwide. The company offers HUMIRA, a therapy administered as an injection for autoimmune and intestinal Behçet's diseases; SKYRIZI to treat moderate to severe plaque psoriasis in adults; RINVOQ, a JAK inhibitor for the treatment of moderate to severe active rheumatoid arthritis in adult patients; IMBRUVICA to treat adult patients with chronic lymphocytic leukemia (CLL), small lymphocytic lymphoma (SLL), and VENCLEXTA, a BCL-2 inhibitor used to treat adults with CLL or SLL; and MAVYRET to treat patients with chronic HCV genotype 1-6 infection. It also provides CREON, a pancreatic enzyme therapy for exocrine pancreatic insufficiency; Synthroid used in the treatment of hypothyroidism; Linzess/Constella to treat irritable bowel syndrome with constipation and chronic idiopathic constipation; Lupron for the palliative treatment of advanced prostate cancer, endometriosis and central precocious puberty, and patients with anemia caused by uterine fibroids; and Botox therapeutic. In addition, the company offers ORILISSA, a nonpeptide small molecule gonadotropin-releasing hormone antagonist for women with moderate to severe endometriosis pain; Duopa and Duodopa, a levodopa-carbidopa intestinal gel to treat Parkinson's disease; Lumigan/Ganfort, a bimatoprost ophthalmic solution for the reduction of elevated intraocular pressure (IOP) in patients with open angle glaucoma (OAG) or ocular hypertension; Ubrelvy to treat migraine with or without aura in adults; Alphagan/ Combigan, an alpha-adrenergic receptor agonist for the reduction of IOP in patients with OAG; and Restasis, a calcineurin inhibitor immunosuppressant to increase tear production, as well as other eye care products. AbbVie Inc. has a research collaboration with Dragonfly Therapeutics, Inc. The company was incorporated in 2012 and is headquartered in North Chicago, Illinois.",United States,AbbVie Inc.,ABBV,7.5,13.819913,282284752896.0,0.037100002,21.282665,0.02,2702.0,149.59,18.062704726251756,18.0,9.380000000000138
370,Healthcare,"Pfizer Inc. discovers, develops, manufactures, markets, distributes, and sells biopharmaceutical products worldwide. It offers medicines and vaccines in various therapeutic areas, including cardiovascular metabolic and women's health under the Premarin family and Eliquis brands; biologics, small molecules, immunotherapies, and biosimilars under the Ibrance, Xtandi, Sutent, Inlyta, Retacrit, Lorbrena, and Braftovi brands; and sterile injectable and anti-infective medicines, and oral COVID-19 treatment under the Sulperazon, Medrol, Zavicefta, Zithromax, Vfend, Panzyga, and Paxlovid brands. The company also provides medicines and vaccines in various therapeutic areas, such as pneumococcal disease, meningococcal disease, tick-borne encephalitis, and COVID-19 under the Comirnaty/BNT162b2, Nimenrix, FSME/IMMUN-TicoVac, Trumenba, and the Prevnar family brands; biosimilars for chronic immune and inflammatory diseases under the Xeljanz, Enbrel, Inflectra, Eucrisa/Staquis, and Cibinqo brands; and amyloidosis, hemophilia, and endocrine diseases under the Vyndaqel/Vyndamax, BeneFIX, and Genotropin brands. In addition, the company is involved in the contract manufacturing business. It serves wholesalers, retailers, hospitals, clinics, government agencies, pharmacies, and individual provider offices, as well as disease control and prevention centers. The company has collaboration agreements with Bristol-Myers Squibb Company; Astellas Pharma US, Inc.; Myovant Sciences Ltd.; Akcea Therapeutics, Inc; Merck KGaA; Valneva SE; BioNTech SE; and Arvinas, Inc. Pfizer Inc. was founded in 1849 and is headquartered in New York, New York.",United States,"Pfizer, Inc.",PFE,1.707,15.572784,276209336320.0,0.035099998,28.828354,0.02,2702.0,45.11,59.89802704500111,59.0,40.50999999999996
310,Healthcare,"Merck & Co., Inc. operates as a healthcare company worldwide. It operates through two segments, Pharmaceutical and Animal Health. The Pharmaceutical segment offers human health pharmaceutical products in the areas of oncology, hospital acute care, immunology, neuroscience, virology, cardiovascular, and diabetes, as well as vaccine products, such as preventive pediatric, adolescent, and adult vaccines. The Animal Health segment discovers, develops, manufactures, and markets veterinary pharmaceuticals, vaccines, and health management solutions and services, as well as digitally connected identification, traceability, and monitoring products. It serves drug wholesalers and retailers, hospitals, and government agencies; managed health care providers, such as health maintenance organizations, pharmacy benefit managers, and other institutions; and physicians and physician distributors, veterinarians, and animal producers. The company has collaborations with AstraZeneca PLC; Bayer AG; Eisai Co., Ltd.; Ridgeback Biotherapeutics; and Gilead Sciences, Inc. to jointly develop and commercialize long-acting treatments in HIV. Merck & Co., Inc. was founded in 1891 and is headquartered in Kenilworth, New Jersey.",United States,"Merck & Company, Inc.",MRK,2.769,14.827586,271538552832.0,0.028199999,38.822678,0.02,2702.0,109.94,24.577042022921596,24.0,63.44000000000024
77,Healthcare,"Bristol-Myers Squibb Company discovers, develops, licenses, manufactures, and markets biopharmaceutical products worldwide. It offers products for hematology, oncology, cardiovascular, immunology, fibrotic, neuroscience, and covid-19 diseases. The company's products include Revlimid, an oral immunomodulatory drug for the treatment of multiple myeloma; Eliquis, an oral inhibitor for reduction in risk of stroke/systemic embolism in NVAF, and for the treatment of DVT/PE; Opdivo for anti-cancer indications; Pomalyst/Imnovid indicated for patients with multiple myeloma; and Orencia for adult patients with active RA and psoriatic arthritis. It also provides Sprycel for the treatment of Philadelphia chromosome-positive chronic myeloid leukemia; Yervoy for the treatment of patients with unresectable or metastatic melanoma; Abraxane, a protein-bound chemotherapy product; Reblozyl for the treatment of anemia in adult patients with beta thalassemia; and Empliciti for the treatment of multiple myeloma. In addition, the company offers Zeposia to treat relapsing forms of multiple sclerosis; Breyanzi, a CD19-directed genetically modified autologous T cell immunotherapy for the treatment of adult patients with relapsed or refractory large B-cell lymphoma; Inrebic, an oral kinase inhibitor indicated for the treatment of adult patients with myelofibrosis; and Onureg for the treatment of adult patients with AML. It sells products to wholesalers, distributors, pharmacies, retailers, hospitals, clinics, and government agencies. The company was formerly known as Bristol-Myers Company. The company was founded in 1887 and is headquartered in New York, New York.",United States,Bristol-Myers Squibb Company,BMY,-2.764,9.942284,175884271616.0,0.029000001,,0.02,2702.0,74.15,36.43964935940661,36.0,32.60000000000004
470,Communication Services,"Verizon Communications Inc., through its subsidiaries, offers communications, technology, information, and entertainment products and services to consumers, businesses, and governmental entities worldwide. Its Consumer segment provides postpaid and prepaid service plans; internet access on notebook computers and tablets; wireless equipment, including smartphones and other handsets; and wireless-enabled internet devices, such as tablets, and other wireless-enabled connected devices comprising smart watches. It also provides residential fixed connectivity solutions, such as internet, video, and voice services; and sells network access to mobile virtual network operators. As of December 31, 2021, it had approximately 115 million wireless retail connections, 7 million wireline broadband connections, and 4 million Fios video connections. The company's Business segment provides network connectivity products, including private networking, private cloud connectivity, virtual and software defined networking, and internet access services; and internet protocol-based voice and video services, unified communications and collaboration tools, and customer contact center solutions. This segment also offers a suite of management and data security services; domestic and global voice and data solutions, such as voice calling, messaging services, conferencing, contact center solutions, and private line and data access networks; customer premises equipment; installation, maintenance, and site services; and Internet of Things products and services. As of December 31, 2021, it had approximately 27 million wireless retail postpaid connections and 477 thousand wireline broadband connections. The company was formerly known as Bell Atlantic Corporation and changed its name to Verizon Communications Inc. in June 2000. Verizon Communications Inc. was incorporated in 1983 and is headquartered in New York, New York.",United States,Verizon Communications Inc.,VZ,4.562,7.5473886,163796598784.0,0.0721,8.553267,0.02,2702.0,40.0,67.55,67.0,21.999999999999886
462,Industrials,"United Parcel Service, Inc. provides letter and package delivery, transportation, logistics, and related services. It operates through two segments, U.S. Domestic Package and International Package. The U.S. Domestic Package segment offers time-definite delivery of letters, documents, small packages, and palletized freight through air and ground services in the United States. The International Package segment provides guaranteed day and time-definite international shipping services in Europe, the Asia Pacific, Canada and Latin America, the Indian sub-continent, the Middle East, and Africa. This segment offers guaranteed time-definite express options. The company also provides international air and ocean freight forwarding, customs brokerage, distribution and post-sales, and mail and consulting services in approximately 200 countries and territories. In addition, it offers truckload brokerage services; supply chain solutions to the healthcare and life sciences industry; shipping, visibility, and billing technologies; and financial and insurance services. The company operates a fleet of approximately 121,000 package cars, vans, tractors, and motorcycles; and owns 59,000 containers that are used to transport cargo in its aircraft. United Parcel Service, Inc. was founded in 1907 and is headquartered in Atlanta, Georgia.",United States,"United Parcel Service, Inc.",UPS,5.922,16.081057,158635802624.0,0.036,30.82067,0.02,2702.0,178.13,15.168697019031045,15.0,30.050000000000054
372,Consumer Defensive,"Philip Morris International Inc. operates as a tobacco company working to delivers a smoke-free future and evolving portfolio for the long-term to include products outside of the tobacco and nicotine sector. The company's product portfolio primarily consists of cigarettes and smoke-free products, including heat-not-burn, vapor, and oral nicotine products that are sold in markets outside the United States. The company offers its smoke-free products under the HEETS, HEETS Creations, HEETS Dimensions, HEETS Marlboro, HEETS FROM MARLBORO, Marlboro Dimensions, Marlboro HeatSticks, Parliament HeatSticks, and TEREA brands, as well as the KT&G-licensed brands, Fiit, and Miix. It also sells its products under the Marlboro, Parliament, Bond Street, Chesterfield, L&M, Lark, and Philip Morris brands. In addition, the company owns various cigarette brands, such as Dji Sam Soe, Sampoerna A, and Sampoerna U in Indonesia; and Fortune and Jackpot in the Philippines. The company sells its smoke-free products in 71 markets. Philip Morris International Inc. was incorporated in 1987 and is headquartered in New York, New York.",United States,Philip Morris International Inc,PM,5.539,14.774436,152958550016.0,0.0574,17.737858,0.02,2702.0,101.82,26.537026124533494,26.0,54.68000000000033
39,Healthcare,"Amgen Inc. discovers, develops, manufactures, and delivers human therapeutics worldwide. It focuses on inflammation, oncology/hematology, bone health, cardiovascular disease, nephrology, and neuroscience areas. The company's products include Enbrel to treat plaque psoriasis, rheumatoid arthritis, and psoriatic arthritis; Neulasta that reduces the chance of infection due a low white blood cell count in patients cancer; Prolia to treat postmenopausal women with osteoporosis; Xgeva for skeletal-related events prevention; Otezla for the treatment of adult patients with plaque psoriasis, psoriatic arthritis, and oral ulcers associated with Behçet's disease; Aranesp to treat a lower-than-normal number of red blood cells and anemia; KYPROLIS to treat patients with relapsed or refractory multiple myeloma; and Repatha, which reduces the risks of myocardial infarction, stroke, and coronary revascularization. It also markets Nplate, Vectibix, MVASI, Parsabiv, EPOGEN, KANJINTI, BLINCYTO, Aimovig, EVENITY, AMGEVITATM, Sensipar/Mimpara, NEUPOGEN, IMLYGIC, Corlanor, and AVSOLA. Amgen Inc. serves healthcare providers, including physicians or their clinics, dialysis centers, hospitals, and pharmacies. It distributes its products through pharmaceutical wholesale distributors, as well as direct-to-consumer channels. It has collaboration agreements with Novartis Pharma AG; UCB; Bayer HealthCare LLC; BeiGene, Ltd.; Eli Lilly and Company; Datos Health; and Verastem, Inc. to evaluate VS-6766 in combination with lumakrastm (Sotorasib) in patients with KRAS G12C-mutant non-small cell lung cancer. It has an agreement with Kyowa Kirin Co., Ltd. to jointly develop and commercialize KHK4083, a Phase 3-ready anti-OX40 fully human monoclonal antibody for the treatment of atopic dermatitis and other autoimmune diseases; and research and development collaboration with Neumora Therapeutics, Inc. and Plexium, Inc. Amgen Inc. was incorporated in 1980 and is headquartered in Thousand Oaks, California.",United States,Amgen Inc.,AMGN,12.46,15.287715,151397695488.0,0.0274,22.77207,0.02,2702.0,263.24,10.264397507977511,10.0,69.6000000000001
460,Industrials,"Union Pacific Corporation, through its subsidiary, Union Pacific Railroad Company, operates in the railroad business in the United States. The company offers transportation services for grain and grain products, fertilizers, food and refrigerated products, and coal and renewables to grain processors, animal feeders, ethanol producers, and other agricultural users; petroleum, and liquid petroleum gases; and construction products, industrial chemicals, plastics, forest products, specialized products, metals and ores, soda ash, and sand, as well as finished automobiles, automotive parts, and merchandise in intermodal containers. As of December 31, 2021, its rail network included 32,452 route miles connecting Pacific Coast and Gulf Coast ports with the Midwest and Eastern United States gateways. The company was founded in 1862 and is headquartered in Omaha, Nebraska.",United States,Union Pacific Corporation,UNP,7.727,19.716267,137144745984.0,0.026600001,27.608385,0.02,2702.0,208.66,12.949295504648711,12.0,198.08000000000013
52,Communication Services,"AT&T Inc. provides telecommunications, media, and technology services worldwide. Its Communications segment offers wireless voice and data communications services; and sells handsets, wireless data cards, wireless computing devices, and carrying cases and hands-free devices through its own company-owned stores, agents, and third-party retail stores. It also provides data, voice, security, cloud solutions, outsourcing, and managed and professional services, as well as customer premises equipment for multinational corporations, small and mid-sized businesses, governmental, and wholesale customers. In addition, this segment offers broadband fiber and legacy telephony voice communication services to residential customers. It markets its communications services and products under the AT&T, Cricket, AT&T PREPAID, and AT&T Fiber brand names. The company's Latin America segment provides wireless services in Mexico; and video services in Latin America. This segment markets its services and products under the AT&T and Unefon brand names. The company was formerly known as SBC Communications Inc. and changed its name to AT&T Inc. in 2005. AT&T Inc. was incorporated in 1983 and is headquartered in Dallas, Texas.",United States,AT&T Inc.,T,2.42,7.439689,136268251136.0,0.0581,7.9008265,0.02,2702.0,19.23,140.50962038481538,140.0,9.799999999999715
291,Industrials,"Lockheed Martin Corporation, a security and aerospace company, engages in the research, design, development, manufacture, integration, and sustainment of technology systems, products, and services worldwide. It operates through four segments: Aeronautics, Missiles and Fire Control, Rotary and Mission Systems, and Space. The Aeronautics segment offers combat and air mobility aircraft, unmanned air vehicles, and related technologies. The Missiles and Fire Control segment provides air and missile defense systems; tactical missiles and air-to-ground precision strike weapon systems; logistics; fire control systems; mission operations support, readiness, engineering support, and integration services; manned and unmanned ground vehicles; and energy management solutions. The Rotary and Mission Systems segment offers military and commercial helicopters, surface ships, sea and land-based missile defense systems, radar systems, sea and air-based mission and combat systems, command and control mission solutions, cyber solutions, and simulation and training solutions. The Space segment offers satellites; space transportation systems; strategic, advanced strike, and defensive missile systems; and classified systems and services in support of national security systems. This segment also provides network-enabled situational awareness and integrates space and ground-based systems to help its customers gather, analyze, and securely distribute critical intelligence data. It serves primarily serves the U.S. government, as well as foreign military sales contracted through the U.S. government. Lockheed Martin Corporation was founded in 1912 and is headquartered in Bethesda, Maryland.",United States,Lockheed Martin Corporation,LMT,24.783,17.328316,133331492864.0,0.025899999,19.507727,0.02,2702.0,443.28,6.095470131745173,6.0,42.32000000000016
221,Healthcare,"Gilead Sciences, Inc., a biopharmaceutical company, discovers, develops, and commercializes medicines in the areas of unmet medical need in the United States, Europe, and internationally. The company provides Biktarvy, Genvoya, Descovy, Odefsey, Truvada, Complera/ Eviplera, Stribild, and Atripla products for the treatment of HIV/AIDS; Veklury, an injection for intravenous use, for the treatment of coronavirus disease 2019; and Epclusa, Harvoni, Vosevi, Vemlidy, and Viread for the treatment of liver diseases. It also offers Yescarta, Tecartus, Trodelvy, and Zydelig products for the treatment of hematology, oncology, and cell therapy patients. In addition, the company provides Letairis, an oral formulation for the treatment of pulmonary arterial hypertension; Ranexa, an oral formulation for the treatment of chronic angina; and AmBisome, a liposomal formulation for the treatment of serious invasive fungal infections. Gilead Sciences, Inc. has collaboration agreements with Arcus Biosciences, Inc.; Pionyr Immunotherapeutics Inc.; Tizona Therapeutics, Inc.; Tango Therapeutics, Inc.; Jounce Therapeutics, Inc.; Galapagos NV; Janssen Sciences Ireland Unlimited Company; Japan Tobacco, Inc.; Gadeta B.V.; Bristol-Myers Squibb Company; Dragonfly Therapeutics, Inc.; and Merck & Co, Inc. The company was incorporated in 1987 and is headquartered in Foster City, California.",United States,"Gilead Sciences, Inc.",GILD,0.24,12.990965,108202827776.0,0.042,359.4167,0.02,2702.0,83.01,32.55029514516323,32.0,45.67999999999995
309,Healthcare,"Medtronic plc develops, manufactures, and sells device-based medical therapies to healthcare systems, physicians, clinicians, and patients worldwide. Its Cardiovascular Portfolio segment offers implantable cardiac pacemakers, cardioverter defibrillators, and cardiac resynchronization therapy devices; cardiac ablation products; insertable cardiac monitor systems; TYRX products; and remote monitoring and patient-centered software. It also provides aortic valves, surgical valve replacement and repair products, endovascular stent grafts and accessories, and transcatheter pulmonary valves; and percutaneous coronary intervention products, percutaneous angioplasty balloons, and products. The company's Medical Surgical Portfolio segment offers surgical stapling devices, vessel sealing instruments, wound closure, electrosurgery products, surgical artificial intelligence and robotic-assisted surgery products, hernia mechanical devices, mesh implants, gynecology and lung products, and various therapies to treat diseases, as well as products in the fields of minimally invasive gastrointestinal and hepatologic diagnostics and therapies, patient monitoring, airway management and ventilation therapies, and renal disease. Its Neuroscience Portfolio segment offers products for spinal surgeons; neurosurgeons; neurologists; pain management specialists; anesthesiologists; orthopedic surgeons; urologists; urogynecologists; interventional radiologists; ear, nose, and throat specialists; and systems that incorporate energy surgical instruments. It also provides image-guided surgery and intra-operative imaging systems and robotic guidance systems used in robot assisted spine procedures; and therapies for vasculature in and around the brain. The company's Diabetes Operating Unit segment offers insulin pumps and consumables, continuous glucose monitoring systems, smart insulin pen systems, and consumables and supplies. The company was founded in 1949 and is headquartered in Dublin, Ireland.",Ireland,Medtronic plc.,MDT,2.259,13.832169,106381590528.0,0.0319,35.024345,0.02,2702.0,80.91,33.39513039179335,33.0,31.97000000000007
113,Financial Services,"Citigroup Inc., a diversified financial services holding company, provides various financial products and services to consumers, corporations, governments, and institutions in North America, Latin America, Asia, Europe, the Middle East, and Africa. The company operates in two segments, Global Consumer Banking (GCB) and Institutional Clients Group (ICG). The GCB segment offers traditional banking services to retail customers through retail banking, Citi-branded cards, and Citi retail services. It also provides various banking, credit card, lending, and investment services through a network of local branches, offices, and electronic delivery systems. The ICG segment offers wholesale banking products and services, including fixed income and equity sales and trading, foreign exchange, prime brokerage, derivative, equity and fixed income research, corporate lending, investment banking and advisory, private banking, cash management, trade finance, and securities services to corporate, institutional, public sector, and high-net-worth clients. As of December 31, 2020, it operated 2,303 branches primarily in the United States, Mexico, and Asia. Citigroup Inc. was founded in 1812 and is headquartered in New York, New York.",United States,"Citigroup, Inc.",C,7.289,5.8533335,95820398592.0,0.045,6.6250515,0.02,2702.0,51.09,52.88706204736739,52.0,45.31999999999979
25,Consumer Defensive,"Altria Group, Inc., through its subsidiaries, manufactures and sells smokeable and oral tobacco products in the United States. The company provides cigarettes primarily under the Marlboro brand; cigars and pipe tobacco principally under the Black & Mild brand; and moist smokeless tobacco products under the Copenhagen, Skoal, Red Seal, and Husky brands, as well as provides on! oral nicotine pouches. It sells its tobacco products primarily to wholesalers, including distributors; and large retail organizations, such as chain stores. Altria Group, Inc. was founded in 1822 and is headquartered in Richmond, Virginia.",United States,"Altria Group, Inc.",MO,2.57,8.8594055,80181690368.0,0.0833,17.408562,0.02,2702.0,44.94,60.124610591900314,60.0,5.60000000000012
