index,symbol,sector,country,dividend_yield,forward_pe,long_business_summary,market_cap,short_name,trailing_eps,trailing_pe,position_weight,target_allocation,current_price,quantity,order_quantity,rounding_loss
376,DOW,Basic Materials,United States,0.0585,10.270917,"Dow Inc. provides various materials science solutions for packaging, infrastructure, mobility, and consumer applications in the United States, Canada, Europe, the Middle East, Africa, India, the Asia Pacific, and Latin America. It operates through Packaging & Specialty Plastics, Industrial Intermediates & Infrastructure, and Performance Materials & Coatings segments. The Packaging & Specialty Plastics segment provides ethylene, and propylene and aromatics products; and polyethylene, polyolefin elastomers, ethylene vinyl acetate, and ethylene propylene diene monomer rubbers. The Industrial Intermediates & Infrastructure segment offers ethylene oxides, propylene oxides, propylene glycol and polyether polyols, aromatic isocyanates and polyurethane systems, coatings, adhesives, sealants, elastomers, and composites. This segment also provides caustic soda, and ethylene dichloride and vinyl chloride monomers; and cellulose ethers, redispersible latex powders, and acrylic emulsions. The Performance Materials and Coatings segment provides architectural paints and coatings, and industrial coatings that are used in maintenance and protective industries, wood, metal packaging, traffic markings, thermal paper, and leather; performance silicones and specialty materials; and silicone feedstocks and intermediates. It also engages in property and casualty insurance, as well as reinsurance business. Dow Inc. was incorporated in 2018 and is headquartered in Midland, Michigan.",38134501376.0,Dow Inc.,2.647,19.478655,0.012195121951219513,1280.4878048780488,58.97,21.714224264508204,21.0,42.11780487804876
361,NEM,Basic Materials,United States,0.0515,11.696428,"Newmont Corporation engages in the production and exploration of gold. It also explores for copper, silver, zinc, and lead. The company has operations and/or assets in the United States, Canada, Mexico, Dominican Republic, Peru, Suriname, Argentina, Chile, Australia, and Ghana. As of December 31, 2021, it had proven and probable gold reserves of 92.8 million ounces and land position of 62,800 square kilometers. The company was founded in 1916 and is headquartered in Denver, Colorado.",36562395136.0,Newmont Corporation,3.187,14.38657,0.012195121951219513,1280.4878048780488,53.32,24.015150128995664,24.0,0.8078048780488123
369,WBA,Healthcare,United States,0.0541,8.0115385,"Walgreens Boots Alliance, Inc. operates as an integrated healthcare, pharmacy, and retailer in the United States (U.S.), the United Kingdom, Germany, and internationally. It operates through three segments: U.S. Retail Pharmacy, International, and U.S. Healthcare. The U.S. Retail Pharmacy segment sells prescription drugs and an assortment of retail products, including health, wellness, beauty, personal care, consumable, and general merchandise products through its retail drugstores. It also provides health and wellness, and specialty and home delivery pharmacy services. As of August 31, 2022, this segment operated 8,886 retail stores under the Walgreens and Duane Reade brands in the United States; and 3 specialty pharmacies. The International segment sells prescription drugs; and health and wellness, beauty, personal care, and other consumer products through its pharmacy-led health and beauty retail stores and optical practices, as well as through boots.com and an integrated mobile application. It also engages in pharmaceutical wholesaling and distribution business in Germany. As of August 31, 2022, this segment operated 3,989 retail stores under the Boots, Benavides, and Ahumada brands in the United Kingdom, Thailand, the Republic of Ireland, and Chile; and 543 optical practices, including 160 on a franchise basis. The U.S. Healthcare segment provides value-based primary care services; post-acute and home care management services; and clinical healthcare services. It also operates as a specialty pharmacy integrator and accelerator for hospitals. As of August 31, 2022, this segment operated 334 VillageMD clinics, including 146 co-located clinics, 124 standalone clinics, and 64 affiliate clinics. Walgreens Boots Alliance, Inc. was founded in 1901 and is based in Deerfield, Illinois.",35991949312.0,"Walgreens Boots Alliance, Inc.",-0.712,0.0,0.012195121951219513,1280.4878048780488,37.17,34.44949703734326,34.0,16.707804878048847
230,CMI,Industrials,United States,0.026300002,14.7046385,"Cummins Inc. designs, manufactures, distributes, and services diesel and natural gas engines, electric and hybrid powertrains, and related components worldwide. It operates through five segments: Engine, Distribution, Components, Power Systems, and New Power. The company offers diesel and natural gas-powered engines under the Cummins and other customer brands for the heavy and medium-duty truck, bus, recreational vehicle, light-duty automotive, construction, mining, marine, rail, oil and gas, defense, and agricultural markets; and offers new parts and services, as well as remanufactured parts and engines. It also provides power generation systems, high-horsepower engines, heavy and medium duty engines, application engineering services, custom-designed assemblies, retail and wholesale aftermarket parts, and in-shop and field-based repair services. In addition, the company offers emission solutions; turbochargers; air and fuel filters, fuel water separators, lube and hydraulic filters, coolants, fuel additives, and other filtration systems; and electronic control modules, sensors, and supporting software, as well as new, replacement, and remanufactured fuel systems. Further, it provides automated transmissions; standby and prime power generators, controls, paralleling systems, and transfer switches, as well as A/C generator/alternator products under the Stamford and AVK brands; and electrified power systems with components and subsystems, including battery, fuel cell, and hydrogen production technologies. Additionally, it offers filtration, aftertreatment, controls systems, air handling systems, automated transmissions, electric power generation systems, and batteries. The company sells its products to original equipment manufacturers, distributors, dealers, and other customers. The company was formerly known as Cummins Engine Company and changed its name to Cummins Inc. in 2001. Cummins Inc. was founded in 1919 and is headquartered in Columbus, Indiana.",35818074112.0,Cummins Inc.,12.01,20.850958,0.012195121951219513,1280.4878048780488,248.69,5.148931621207321,5.0,37.03780487804873
304,HPQ,Technology,United States,0.0367,8.893805,"HP Inc. provides personal computing and other access devices, imaging and printing products, and related technologies, solutions, and services in the United States and internationally. The company operates through three segments: Personal Systems, Printing, and Corporate Investments. The Personal Systems segment offers commercial and consumer desktop and notebook personal computers, workstations, thin clients, commercial mobility devices, retail point-of-sale systems, displays and peripherals, software, support, and services. The Printing segment provides consumer and commercial printer hardware, supplies, solutions, and services. The Corporate Investments segment is involved in the HP Labs and business incubation, and investment projects. It serves individual consumers, small- and medium-sized businesses, and large enterprises, including customers in the government, health, and education sectors. The company was formerly known as Hewlett-Packard Company and changed its name to HP Inc. in October 2015. HP Inc. was founded in 1939 and is headquartered in Palo Alto, California.",32644007936.0,HP Inc.,2.352,12.818877,0.012195121951219513,1280.4878048780488,29.23,43.80731456989561,43.0,23.59780487804867
235,FAST,Industrials,United States,0.026600001,30.602339,"Fastenal Company, together with its subsidiaries, engages in the wholesale distribution of industrial and construction supplies in the United States, Canada, Mexico, North America, and internationally. It offers fasteners, and related industrial and construction supplies under the Fastenal name. The company's fastener products include threaded fasteners, bolts, nuts, screws, studs, and related washers, which are used in manufactured products and construction projects, as well as in the maintenance and repair of machines. It also offers miscellaneous supplies and hardware, including pins, machinery keys, concrete anchors, metal framing systems, wire ropes, strut products, rivets, and related accessories. The company serves the manufacturing market comprising original equipment manufacturers; maintenance, repair, and operations; and non-residential construction market, which includes general, electrical, plumbing, sheet metal, and road contractors. It also serves farmers, truckers, railroads, mining companies, schools, and retail trades; and oil exploration, production, and refinement companies, as well as federal, state, and local governmental entities. The company distributes its products through a network of 3,209 in-market locations and 15 distribution centers. Fastenal Company was founded in 1967 and is headquartered in Winona, Minnesota.",30098280448.0,Fastenal Company,1.51,34.655632,0.012195121951219513,1280.4878048780488,50.25,25.482344375682562,25.0,24.23780487804873
284,GLW,Technology,United States,0.033299997,14.216665,"Corning Incorporated engages in display technologies, optical communications, environmental technologies, specialty materials, and life sciences businesses worldwide. The company's Display Technologies segment offers glass substrates for liquid crystal displays and organic light-emitting diodes used in televisions, notebook computers, desktop monitors, tablets, and handheld devices. Its Optical Communications segment provides optical fibers and cables; and hardware and equipment products, including cable assemblies, fiber optic hardware and connectors, optical components and couplers, closures, network interface devices, and other accessories. This segment also offers its products to businesses, governments, and individuals. Its Specialty Materials segment manufactures products that provide material formulations for glass, glass ceramics, crystals, precision metrology instruments, software; as well as ultra-thin and ultra-flat glass wafers, substrates, tinted sunglasses, and radiation shielding products. This segment serves various industries, including mobile consumer electronics, semiconductor equipment optics and consumables; aerospace and defense optics; radiation shielding products, sunglasses, and telecommunications components. The company's Environmental Technologies segment offers ceramic substrates and filter products for emissions control in mobile, gasoline, and diesel applications. The company's Life Sciences segment offers laboratory products comprising consumables, such as plastic vessels, liquid handling plastics, specialty surfaces, cell culture media, and serum, as well as general labware and equipment under the Corning, Falcon, Pyrex, and Axygen brands. The company was formerly known as Corning Glass Works and changed its name to Corning Incorporated in April 1989. Corning Incorporated was founded in 1851 and is headquartered in Corning, New York.",29118279680.0,Corning Incorporated,1.41,24.198582,0.012195121951219513,1280.4878048780488,36.8,34.795864262990456,34.0,29.287804878048778
373,LYB,Basic Materials,United States,0.0577,7.033225,"LyondellBasell Industries N.V. operates as a chemical company in the United States, Germany, Mexico, Italy, Poland, France, Japan, China, the Netherlands, and internationally. The company operates in six segments: Olefins and PolyolefinsAmericas; Olefins and PolyolefinsEurope, Asia, International; Intermediates and Derivatives; Advanced Polymer Solutions; Refining; and Technology. It produces and markets olefins and co-products; polyolefins; polyethylene products, which consist of high density polyethylene, low density polyethylene, and linear low density polyethylene; and polypropylene (PP) products, such as PP homopolymers and copolymers. The company also produces and sells propylene oxide and its derivatives; oxyfuels and related products; and intermediate chemicals, such as styrene monomers, acetyls, ethylene glycols, and ethylene oxides and derivatives. In addition, it produces and markets compounds and solutions, such as polypropylene compounds, engineered plastics, masterbatches, engineered composites, colors, and powders; and advanced polymers. Further, the company refines crude oil and other crude oils of varied types and sources into gasoline and distillates; develops and licenses chemical and polyolefin process technologies; and manufactures and sells polyolefin catalysts. LyondellBasell Industries N.V. was incorporated in 2009 and is headquartered in Houston, Texas.",28882323456.0,LyondellBasell Industries NV,7.005,12.389722,0.012195121951219513,1280.4878048780488,95.55,13.401232913428036,13.0,38.33780487804881
341,TROW,Financial Services,United States,0.044,9.731518,"T. Rowe Price Group, Inc. is a publicly owned investment manager. The firm provides its services to individuals, institutional investors, retirement plans, financial intermediaries, and institutions. It launches and manages equity and fixed income mutual funds. The firm invests in the public equity and fixed income markets across the globe. It employs fundamental and quantitative analysis with a bottom-up approach. The firm utilizes in-house and external research to make its investments. It employs socially responsible investing with a focus on environmental, social, and governance issues. It makes investment in late-stage venture capital transactions and usually invests between $3 million and $5 million. The firm was previously known as T. Rowe Group, Inc. and T. Rowe Price Associates, Inc. T. Rowe Price Group, Inc. was founded in 1937 and is based in Baltimore, Maryland, with additional offices in Colorado Springs, Colorado; Owings Mills, Maryland; San Francisco, California; New York, New York; Philadelphia, Pennsylvania; Tampa, Florida; Toronto, Ontario; Hellerup, Denmark; Amsterdam, The Netherlands; Luxembourg, Grand Duchy of Luxembourg; Zurich, Switzerland; Dubai, United Arab Emirates; London, United Kingdom; Sydney, New South Wales; Hong Kong; Tokyo, Japan; Singapore; Frankfurt, Germany, Madrid, Spain, Milan, Italy, Stockholm, Sweden, Melbourne, Australia, and Amsterdam, Netherlands.",28661211136.0,"T. Rowe Price Group, Inc.",11.776,10.619056,0.012195121951219513,1280.4878048780488,116.29,11.011160072904365,11.0,1.297804878048663
356,EIX,Utilities,United States,0.049200002,13.550634,"Edison International, through its subsidiaries, generates and distributes electric power. It delivers electricity to 15 million residential, commercial, industrial, public authorities, agricultural, and other customers across Southern, Central, and Coastal California. The company also provides energy solutions to commercial and industrial users. Its transmission facilities consist of lines ranging from 55 kV to 500 kV and substations; and distribution system consists of approximately 39,000 circuit-miles of overhead lines, approximately 31,000 circuit-miles of underground lines, and 800 substations. The company was founded in 1886 and is headquartered in Rosemead, California.",24401491968.0,Edison International,2.161,29.722353,0.012195121951219513,1280.4878048780488,68.74,18.62798668719885,18.0,43.16780487804887
336,FE,Utilities,United States,0.0429,15.3307705,"FirstEnergy Corp., through its subsidiaries, generates, transmits, and distributes electricity in the United States. It operates through Regulated Distribution and Regulated Transmission segments. The company owns and operates coal-fired, nuclear, hydroelectric, natural gas, wind, and solar power generating facilities. It operates 24,074 circuit miles of overhead and underground transmission lines; and electric distribution systems, including 273,295 miles of overhead pole line and underground conduit carrying primary, secondary, and street lighting circuits. The company serves approximately 6 million customers in Ohio, Pennsylvania, West Virginia, Maryland, New Jersey, and New York. FirstEnergy Corp. was incorporated in 1996 and is headquartered in Akron, Ohio.",22727694336.0,FirstEnergy Corp.,2.468,16.15073,0.012195121951219513,1280.4878048780488,41.23,31.057186632986877,31.0,2.3578048780489334
331,HBAN,Financial Services,United States,0.0416,10.964028,"Huntington Bancshares Incorporated operates as the bank holding company for The Huntington National Bank that provides commercial, consumer, and mortgage banking services in the United States. The company operates through four segments: Consumer and Business Banking; Commercial Banking; Vehicle Finance; and Regional Banking and The Huntington Private Client Group (RBHPCG). The Consumer and Business Banking segment offers financial products and services, such as checking accounts, savings accounts, money market accounts, certificates of deposit, credit cards, and consumer and small business loans, as well as investment products. This segment also provides mortgages, insurance, interest rate risk protection, foreign exchange, automated teller machine, and treasury management services, as well as online, mobile, and telephone banking services. It serves consumer and small business customers. The Commercial Banking segment offers regional commercial banking solutions for middle market businesses, government and public sector entities, and commercial real estate developers/REITs; and specialty banking solutions for healthcare, technology and telecommunications, franchise finance, sponsor finance, and global services industries. It also provides asset finance services; capital raising solutions, sales and trading, and corporate risk management products; institutional banking services; and treasury management services. The Vehicle Finance segment provides financing to consumers for the purchase of automobiles, light-duty trucks, recreational vehicles, and marine craft at franchised and other select dealerships, as well as to franchised dealerships for the acquisition of new and used inventory. The RBHPCG segment offers private banking, wealth and investment management, and retirement plan services. As of March 18, 2022, the company had approximately 1,000 branches in 11 states. Huntington Bancshares Incorporated was founded in 1866 and is headquartered in Columbus, Ohio.",22471989248.0,Huntington Bancshares Incorpora,1.142,13.345009,0.012195121951219513,1280.4878048780488,15.01,85.30898100453356,85.0,4.637804878048795
286,HPE,Technology,United States,0.0341,8.244792,"Hewlett Packard Enterprise Company provides solutions that allow customers to capture, analyze, and act upon data seamlessly in the Americas, Europe, the Middle East, Africa, the Asia Pacific, and Japan. The company offers general purpose servers for multi-workload computing and workload-optimized servers; HPE ProLiant rack and tower servers; HPE BladeSystem and HPE Synergy; and solutions for secondary workloads and traditional tape, storage networking, and disk products, such as HPE Modular Storage Arrays and HPE XP. It also offers HPE Apollo and Cray products; and HPE Superdome Flex, HPE Nonstop, HPE Integrity, and HPE Edgeline products. In addition, the company provides HPE Aruba product portfolio that includes wired and wireless local area network hardware products, such as Wi-Fi access points, switches, routers, and sensors; HPE Aruba software and services comprising cloud-based management, network management, network access control, analytics and assurance, and location; and professional and support services, as well as as-a-service and consumption models for the intelligent edge portfolio of products. Further, it offers various leasing, financing, IT consumption, and utility programs and asset management services for customers to facilitate technology deployment models and the acquisition of complete IT solutions, including hardware, software, and services from Hewlett Packard Enterprise and others. Additionally, the company invests in communications and media solutions. It has a partnership with Striim, Inc. to offer high performance and mission-critical solutions with real-time analytics. It serves commercial and large enterprise groups, such as business and public sector enterprises; and through various partners comprising resellers, distribution partners, original equipment manufacturers, independent software vendors, systems integrators, and advisory firms. Hewlett Packard Enterprise Company was founded in 1939 and is headquartered in Houston, Texas.",20475154432.0,Hewlett Packard Enterprise Comp,-0.334,0.0,0.012195121951219513,1280.4878048780488,16.14,79.33629522168827,79.0,5.427804878048753
368,BBY,Consumer Cyclical,United States,0.0535,10.21761,"Best Buy Co., Inc. retails technology products in the United States and Canada. The company operates in two segments, Domestic and International. Its stores provide computing products, such as desktops, notebooks, and peripherals; mobile phones comprising related mobile network carrier commissions; networking products; tablets covering e-readers; smartwatches; and consumer electronics consisting of digital imaging, health and fitness, home theater, portable audio comprising headphones and portable speakers, and smart home products. The company's stores also offer appliances, such as dishwashers, laundry, ovens, refrigerators, blenders, coffee makers, and vacuums; entertainment products consisting of drones, peripherals, movies, music, and toys, as well as gaming hardware and software, and virtual reality and other software products; and other products, such as baby, food and beverage, luggage, outdoor living, and sporting goods. In addition, it provides consultation, delivery, design, health-related, installation, memberships, repair, set-up, technical support, and warranty-related services. The company offers its products through stores and websites under the Best Buy, Best Buy Ads, Best Buy Business, Best Buy Health, CST, Current Health, Geek Squad, Lively, Magnolia, Best Buy Mobile, Pacific Kitchen, Home, and Yardbird, as well as domain names bestbuy.com, currenthealth.com, lively.com, yardbird.com, and bestbuy.ca. As of January 30, 2022, it had 1,144 stores. The company was formerly known as Sound of Music, Inc. The company was incorporated in 1966 and is headquartered in Richfield, Minnesota.",19540770816.0,"Best Buy Co., Inc.",6.84,11.875731,0.012195121951219513,1280.4878048780488,85.18,15.032728397253448,15.0,2.787804878048739
329,AMCR,Consumer Cyclical,Switzerland,0.040599998,14.554217,"Amcor plc develops, produces, and sells packaging products in Europe, North America, Latin America, Africa, and the Asia Pacific regions. The company operates through two segments, Flexibles and Rigid Packaging. The Flexibles segment provides flexible and film packaging products in the food and beverage, medical and pharmaceutical, fresh produce, snack food, personal care, and other industries. The Rigid Packaging segment offers rigid containers for a range of beverage and food products, including carbonated soft drinks, water, juices, sports drinks, milk-based beverages, spirits and beer, sauces, dressings, spreads, and personal care items; and plastic caps for various applications. The company sells its products primarily through its direct sales force. Amcor plc was incorporated in 2018 and is headquartered in Zürich, Switzerland.",17987362816.0,Amcor plc,0.56,21.571428,0.012195121951219513,1280.4878048780488,11.95,107.153791203184,107.0,1.837804878048793
332,CFG,Financial Services,United States,0.0418,10.026316,"Citizens Financial Group, Inc. operates as the bank holding company for Citizens Bank, National Association that provides retail and commercial banking products and services to individuals, small businesses, middle-market companies, corporations, and institutions in the United States. The company operates in two segments, Consumer Banking and Commercial Banking. The Consumer Banking segment offers deposit products, mortgage and home equity lending products, credit cards, business loans, wealth management, and investment services; and auto, education, and point-of-sale finance loans, as well as digital deposit products. This segment serves its customers through telephone service centers, as well as through its online and mobile platforms. The Commercial Banking segment provides various financial products and solutions, including lending and leasing, deposit and treasury management services, foreign exchange, and interest rate and commodity risk management solutions, as well as syndicated loans, corporate finance, mergers and acquisitions, and debt and equity capital markets services. This segment serves government banking, not-for-profit, healthcare, technology, professionals, oil and gas, asset finance, franchise finance, asset-based lending, commercial real estate, private equity, and sponsor finance industries. It operates approximately 1,200 branches in 14 states and the District of Columbia; 114 retail and commercial non-branch offices in national markets; and approximately 3,300 automated teller machines. The company was formerly known as RBS Citizens Financial Group, Inc. and changed its name to Citizens Financial Group, Inc. in April 2014. Citizens Financial Group, Inc. was founded in 1828 and is headquartered in Providence, Rhode Island.",17862041600.0,"Citizens Financial Group, Inc.",3.562,11.7658615,0.012195121951219513,1280.4878048780488,43.29,29.5792978719808,29.0,25.07780487804879
