index,symbol,sector,country,dividend_yield,forward_pe,long_business_summary,market_cap,short_name,trailing_eps,trailing_pe,position_weight,target_allocation,current_price,quantity,order_quantity,rounding_loss
333,GILD,Healthcare,United States,0.042,12.990965,"Gilead Sciences, Inc., a biopharmaceutical company, discovers, develops, and commercializes medicines in the areas of unmet medical need in the United States, Europe, and internationally. The company provides Biktarvy, Genvoya, Descovy, Odefsey, Truvada, Complera/ Eviplera, Stribild, and Atripla products for the treatment of HIV/AIDS; Veklury, an injection for intravenous use, for the treatment of coronavirus disease 2019; and Epclusa, Harvoni, Vosevi, Vemlidy, and Viread for the treatment of liver diseases. It also offers Yescarta, Tecartus, Trodelvy, and Zydelig products for the treatment of hematology, oncology, and cell therapy patients. In addition, the company provides Letairis, an oral formulation for the treatment of pulmonary arterial hypertension; Ranexa, an oral formulation for the treatment of chronic angina; and AmBisome, a liposomal formulation for the treatment of serious invasive fungal infections. Gilead Sciences, Inc. has collaboration agreements with Arcus Biosciences, Inc.; Pionyr Immunotherapeutics Inc.; Tizona Therapeutics, Inc.; Tango Therapeutics, Inc.; Jounce Therapeutics, Inc.; Galapagos NV; Janssen Sciences Ireland Unlimited Company; Japan Tobacco, Inc.; Gadeta B.V.; Bristol-Myers Squibb Company; Dragonfly Therapeutics, Inc.; and Merck & Co, Inc. The company was incorporated in 1987 and is headquartered in Foster City, California.",108000000000.0,"Gilead Sciences, Inc.",0.24,359.4167,0.02,2100.0,83.73,25.08061626657112,25.0,6.749999999999867
271,MDT,Healthcare,Ireland,0.0319,13.832169,"Medtronic plc develops, manufactures, and sells device-based medical therapies to healthcare systems, physicians, clinicians, and patients worldwide. Its Cardiovascular Portfolio segment offers implantable cardiac pacemakers, cardioverter defibrillators, and cardiac resynchronization therapy devices; cardiac ablation products; insertable cardiac monitor systems; TYRX products; and remote monitoring and patient-centered software. It also provides aortic valves, surgical valve replacement and repair products, endovascular stent grafts and accessories, and transcatheter pulmonary valves; and percutaneous coronary intervention products, percutaneous angioplasty balloons, and products. The company's Medical Surgical Portfolio segment offers surgical stapling devices, vessel sealing instruments, wound closure, electrosurgery products, surgical artificial intelligence and robotic-assisted surgery products, hernia mechanical devices, mesh implants, gynecology and lung products, and various therapies to treat diseases, as well as products in the fields of minimally invasive gastrointestinal and hepatologic diagnostics and therapies, patient monitoring, airway management and ventilation therapies, and renal disease. Its Neuroscience Portfolio segment offers products for spinal surgeons; neurosurgeons; neurologists; pain management specialists; anesthesiologists; orthopedic surgeons; urologists; urogynecologists; interventional radiologists; ear, nose, and throat specialists; and systems that incorporate energy surgical instruments. It also provides image-guided surgery and intra-operative imaging systems and robotic guidance systems used in robot assisted spine procedures; and therapies for vasculature in and around the brain. The company's Diabetes Operating Unit segment offers insulin pumps and consumables, continuous glucose monitoring systems, smart insulin pen systems, and consumables and supplies. The company was founded in 1949 and is headquartered in Dublin, Ireland.",106000000000.0,Medtronic plc.,2.259,35.024345,0.02,2100.0,82.58,25.42988617098571,25.0,35.499999999999986
344,C,Financial Services,United States,0.045,5.8533335,"Citigroup Inc., a diversified financial services holding company, provides various financial products and services to consumers, corporations, governments, and institutions in North America, Latin America, Asia, Europe, the Middle East, and Africa. The company operates in two segments, Global Consumer Banking (GCB) and Institutional Clients Group (ICG). The GCB segment offers traditional banking services to retail customers through retail banking, Citi-branded cards, and Citi retail services. It also provides various banking, credit card, lending, and investment services through a network of local branches, offices, and electronic delivery systems. The ICG segment offers wholesale banking products and services, including fixed income and equity sales and trading, foreign exchange, prime brokerage, derivative, equity and fixed income research, corporate lending, investment banking and advisory, private banking, cash management, trade finance, and securities services to corporate, institutional, public sector, and high-net-worth clients. As of December 31, 2020, it operated 2,303 branches primarily in the United States, Mexico, and Asia. Citigroup Inc. was founded in 1812 and is headquartered in New York, New York.",95820398592.0,"Citigroup, Inc.",7.289,6.6250515,0.02,2100.0,51.86,40.49363671423062,40.0,25.59999999999986
385,MO,Consumer Defensive,United States,0.0833,8.8594055,"Altria Group, Inc., through its subsidiaries, manufactures and sells smokeable and oral tobacco products in the United States. The company provides cigarettes primarily under the Marlboro brand; cigars and pipe tobacco principally under the Black & Mild brand; and moist smokeless tobacco products under the Copenhagen, Skoal, Red Seal, and Husky brands, as well as provides on! oral nicotine pouches. It sells its tobacco products primarily to wholesalers, including distributors; and large retail organizations, such as chain stores. Altria Group, Inc. was founded in 1822 and is headquartered in Richmond, Virginia.",80181690368.0,"Altria Group, Inc.",2.57,17.408562,0.02,2100.0,44.14,47.5758948799275,47.0,25.41999999999999
343,DUK,Utilities,United States,0.0442,18.2789,"Duke Energy Corporation, together with its subsidiaries, operates as an energy company in the United States. It operates through three segments: Electric Utilities and Infrastructure, Gas Utilities and Infrastructure, and Commercial Renewables. The Electric Utilities and Infrastructure segment generates, transmits, distributes, and sells electricity in the Carolinas, Florida, and the Midwest; and uses coal, hydroelectric, natural gas, oil, renewable generation, and nuclear fuel to generate electricity. It also engages in the wholesale of electricity to municipalities, electric cooperative utilities, and load-serving entities. This segment serves approximately 8.2 million customers in 6 states in the Southeast and Midwest regions of the United States covering a service territory of approximately 91,000 square miles; and owns approximately 50,259 megawatts (MW) of generation capacity. The Gas Utilities and Infrastructure segment distributes natural gas to residential, commercial, industrial, and power generation natural gas customers; and owns, operates, and invests in pipeline transmission and natural gas storage facilities. It has approximately 1.6 million customers, including 1.1 million customers in North Carolina, South Carolina, and Tennessee, as well as 550,000 customers in southwestern Ohio and northern Kentucky. The Commercial Renewables segment acquires, owns, develops, builds, and operates wind and solar renewable generation projects, including nonregulated renewable energy and energy storage services to utilities, electric cooperatives, municipalities, and corporate customers. It has 23 wind, 178 solar, and 2 battery storage facilities, as well as 71 fuel cell locations with a capacity of 3,554 MW across 22 states. The company was formerly known as Duke Energy Holding Corp. and changed its name to Duke Energy Corporation in April 2005. The company was founded in 1904 and is headquartered in Charlotte, North Carolina.",76641951744.0,Duke Energy Corporation (Holdin,1.719,57.9523,0.02,2100.0,101.58,20.67336089781453,20.0,68.39999999999986
0,MMM,Industrials,United States,0.0463,12.336519,"3M Company operates as a diversified technology company worldwide. It operates through four segments: Safety and Industrial; Transportation and Electronics; Health Care; and Consumer. The Safety and Industrial segment offers industrial abrasives and finishing for metalworking applications; autobody repair solutions; closure systems for personal hygiene products, masking, and packaging materials; electrical products and materials for construction and maintenance, power distribution, and electrical original equipment manufacturers; structural adhesives and tapes; respiratory, hearing, eye, and fall protection solutions; and natural and color-coated mineral granules for shingles. The Transportation and Electronics segment provides ceramic solutions; attachment tapes, films, sound, and temperature management for transportation vehicles; premium large format graphic films for advertising and fleet signage; light management films and electronics assembly solutions; packaging and interconnection solutions; and reflective signage for highway, and vehicle safety. The Healthcare segment offers food safety indicator solutions; health care procedure coding and reimbursement software; skin, wound care, and infection prevention products and solutions; dentistry and orthodontia solutions; and filtration and purification systems. The Consumer segment provides consumer bandages, braces, supports and consumer respirators; cleaning products for the home; retail abrasives, paint accessories, car care DIY products, picture hanging, and consumer air quality solutions; and stationery products. It offers its products through e-commerce and traditional wholesalers, retailers, jobbers, distributors, and dealers. The company was founded in 1902 and is based in St. Paul, Minnesota.",71325949952.0,3M Company,11.46,11.260035,0.02,2100.0,115.25,18.22125813449024,18.0,25.499999999999957
330,SO,Utilities,United States,0.0414,18.794945,"The Southern Company, through its subsidiaries, engages in the generation, transmission, and distribution of electricity. It operates through Gas Distribution Operations, Gas Pipeline Investments, Wholesale Gas Services, and Gas Marketing Services segments. The company also develops, constructs, acquires, owns, and manages power generation assets, including renewable energy projects and sells electricity in the wholesale market; and distributes natural gas in Illinois, Georgia, Virginia, and Tennessee, as well as provides gas marketing services, wholesale gas services, and gas pipeline investments operations. In addition, it owns and/or operates 30 hydroelectric generating stations, 24 fossil fuel generating stations, three nuclear generating stations, 13 combined cycle/cogeneration stations, 45 solar facilities, 15 wind facilities, one fuel cell facility, and four battery storage facility; and constructs, operates, and maintains 76,289 miles of natural gas pipelines and 14 storage facilities with total capacity of 157 Bcf to provide natural gas to residential, commercial, and industrial customers. The company serves approximately 8.7 million electric and gas utility customers. Further, the company offers digital wireless communications and fiber optics services. The Southern Company was incorporated in 1945 and is headquartered in Atlanta, Georgia.",70911221760.0,Southern Company (The),3.18,21.040882,0.02,2100.0,68.0,30.88235294117647,30.0,60.00000000000003
346,USB,Financial Services,United States,0.045300003,10.128146,"U.S. Bancorp, a financial services holding company, provides various financial services to individuals, businesses, institutional organizations, governmental entities and other financial institutions in the United States. It operates in Corporate and Commercial Banking, Consumer and Business Banking, Wealth Management and Investment Services, Payment Services, and Treasury and Corporate Support segments. The company offers depository services, including checking accounts, savings accounts, and time certificate contracts; lending services, such as traditional credit products; and credit card services, lease financing and import/export trade, asset-backed lending, agricultural finance, and other products. It also provides ancillary services comprising capital markets, treasury management, and receivable lock-box collection services to corporate and governmental entity customers; and a range of asset management and fiduciary services for individuals, estates, foundations, business corporations, and charitable organizations. In addition, the company offers investment and insurance products to its customers principally within its markets, as well as fund administration services to a range of mutual and other funds. Further, it provides corporate and purchasing card, and corporate trust services; and merchant processing services, as well as investment management, ATM processing, mortgage banking, insurance, and brokerage and leasing services. As of December 31, 2021, the company provided its products and services through a network of 2,230 banking offices principally operating in the Midwest and West regions of the United States, as well as through on-line services, over mobile devices, and other distribution channels; and operated a network of 4,059 ATMs. The company was founded in 1863 and is headquartered in Minneapolis, Minnesota.",65628725248.0,U.S. Bancorp,3.789,11.681182,0.02,2100.0,48.86,42.97994269340974,42.0,47.87999999999988
349,TFC,Financial Services,United States,0.0471,9.654321,"Truist Financial Corporation, a holding company, provides banking and trust services in the Southeastern and Mid-Atlantic United States. The company operates through three segments: Consumer Banking and Wealth, Corporate and Commercial Banking, and Insurance Holdings. Its deposit products include noninterest-bearing checking, interest-bearing checking, savings, and money market deposit accounts, as well as certificates of deposit and individual retirement accounts. The company also provides funding; asset management; automobile lending; bankcard lending; consumer finance; home equity and mortgage lending; insurance, such as property and casualty, life, health, employee benefits, workers compensation and professional liability, surety coverage, title, and other insurance products; investment brokerage; mobile/online banking; and payment, lease financing, small business lending, and wealth management/private banking services. In addition, it offers association, capital market, institutional trust, insurance premium and commercial finance, international banking, leasing, merchant, commercial deposit and treasury, government finance, commercial middle market lending, small business and student lending, floor plan and commercial mortgage lending, mortgage warehouse lending, private equity investment, real estate lending, and supply chain financing services. Further, the company provides corporate and investment banking, retail and wholesale brokerage, securities underwriting, and investment advisory services. As of December 31, 2021, the company operated through 2,517 banking offices. The company was formerly known as BB&T Corporation and changed its name to Truist Financial Corporation in December 2019. Truist Financial Corporation was founded in 1872 and is headquartered in Charlotte, North Carolina.",62633033728.0,Truist Financial Corporation,4.238,11.0712595,0.02,2100.0,48.84,42.99754299754299,42.0,48.71999999999979
348,F,Consumer Cyclical,United States,0.0468,8.331361,"Ford Motor Company designs, manufactures, markets, and services a range of Ford trucks, cars, sport utility vehicles, electrified vehicles, and Lincoln luxury vehicles worldwide. It operates through three segments: Automotive, Mobility, and Ford Credit. The Automotive segment sells Ford and Lincoln vehicles, service parts, and accessories through distributors and dealers, as well as through dealerships to commercial fleet customers, daily rental car companies, and governments. The Mobility segment designs and builds mobility services; and provides self-driving systems development services. The Ford Credit segment primarily engages in vehicle-related financing and leasing activities to and through automotive dealers. It provides retail installment sale contracts for new and used vehicles; and direct financing leases for new vehicles to retail and commercial customers, such as leasing companies, government entities, daily rental companies, and fleet customers. This segment also offers wholesale loans to dealers to finance the purchase of vehicle inventory; and loans to dealers to finance working capital and enhance dealership facilities, purchase dealership real estate, and other dealer vehicle programs. The company has a strategic collaboration with ARB Corporation Limited to develop a suite of aftermarket products for the new Ford Bronco. Ford Motor Company was incorporated in 1903 and is based in Dearborn, Michigan.",56267055104.0,Ford Motor Company,0.994,14.164989,0.02,2100.0,13.27,158.25169555388095,158.0,3.3400000000002033
339,KHC,Consumer Defensive,United States,0.0432,14.624061,"The Kraft Heinz Company, together with its subsidiaries, manufactures and markets food and beverage products in the United States, Canada, the United Kingdom, and internationally. Its products include condiments and sauces, cheese and dairy products, meals, meats, refreshment beverages, coffee, and other grocery products. The company also offers dressings, healthy snacks, and other categories; and spices and other seasonings. It sells its products through its own sales organizations, as well as through independent brokers, agents, and distributors to chain, wholesale, cooperative and independent grocery accounts, convenience stores, drug stores, value stores, bakeries, pharmacies, mass merchants, club stores, and foodservice distributors and institutions, including hotels, restaurants, hospitals, health care facilities, and government agencies; and online through various e-commerce platforms and retailers. The company was formerly known as H.J. Heinz Holding Corporation and changed its name to The Kraft Heinz Company in July 2015. The Kraft Heinz Company was founded in 1869 and is headquartered in Pittsburgh, Pennsylvania.",47615156224.0,The Kraft Heinz Company,0.442,88.009056,0.012195121951219513,1280.4878048780488,39.69,32.26222738417861,32.0,10.40780487804896
254,FDX,Industrials,United States,0.0291,8.955905,"FedEx Corporation provides transportation, e-commerce, and business services in the United States and internationally. The company's FedEx Express segment offers express transportation, small-package ground delivery, and freight transportation services; time-critical transportation services; and cross-border enablement, technology, and e-commerce transportation solutions. Its FedEx Ground segment provides day-certain delivery services to businesses and residences. The company's FedEx Freight segment offers less-than-truckload freight transportation services. As of May 31, 2022, this segment had approximately 30,000 vehicles and 400 service centers. Its FedEx Services segment provides sales, marketing, information technology, communications, customer service, technical support, billing and collection, and back-office support services. The company's Corporate, Other and Eliminations segment offers integrated supply chain management solutions, specialty transportation, customs brokerage, and global ocean and air freight forwarding services; and document and business services, as well as retail access to its customers for its package transportation businesses. FedEx Corporation was founded in 1971 and is based in Memphis, Tennessee.",46820020224.0,FedEx Corporation,11.357,15.558685,0.012195121951219513,1280.4878048780488,190.56,6.7196043496958895,6.0,137.1278048780487
319,KMB,Consumer Defensive,United States,0.038599998,17.027742,"Kimberly-Clark Corporation, together with its subsidiaries, manufactures and markets personal care and consumer tissue products worldwide. It operates through three segments: Personal Care, Consumer Tissue, and K-C Professional. The Personal Care segment offers disposable diapers, swimpants, training and youth pants, baby wipes, feminine and incontinence care products, and other related products under the Huggies, Pull-Ups, Little Swimmers, GoodNites, DryNites, Sweety, Kotex, U by Kotex, Intimus, Depend, Plenitud, Softex, Poise, and other brand names. The Consumer Tissue segment provides facial and bathroom tissues, paper towels, napkins, and related products under the Kleenex, Scott, Cottonelle, Viva, Andrex, Scottex, Neve, and other brand names. The K-C Professional segment offers wipers, tissues, towels, apparel, soaps, and sanitizers under the Kleenex, Scott, WypAll, Kimtech, and KleenGuard brands. The company sells household use products directly to supermarkets, mass merchandisers, drugstores, warehouse clubs, variety and department stores, and other retail outlets, as well as through other distributors and e-commerce; and away-from-home use products directly to manufacturing, lodging, office building, food service, and public facilities, as well as through distributors and e-commerce. Kimberly-Clark Corporation was founded in 1872 and is headquartered in Dallas, Texas.",45466894336.0,Kimberly-Clark Corporation,6.668,20.250448,0.012195121951219513,1280.4878048780488,128.92,9.93242169467925,9.0,120.20780487804899
241,PAYX,Industrials,United States,0.0274,38.38318,"Paychex, Inc. provides integrated human capital management solutions for human resources (HR), payroll, benefits, and insurance services for small to medium-sized businesses in the United States, Europe, and India. It offers payroll processing services; payroll tax administration services; employee payment services; and regulatory compliance services, such as new-hire reporting and garnishment processing. The company also provides HR solutions, including payroll, employer compliance, HR and employee benefits administration, risk management outsourcing, and the on-site availability of a professionally trained HR representative; and retirement services administration, including plan implementation, ongoing compliance with government regulations, employee and employer reporting, participant and employer online access, electronic funds transfer, and other administrative services. In addition, it offers cloud-based HR administration software products for employee benefits management and administration, time and attendance, digital communication solutions, recruiting, and onboarding solutions; plan administration outsourcing and state unemployment insurance services; various business services to small to medium-sized businesses comprising payroll funding and outsourcing services, which include payroll processing, invoicing, and tax preparation; and payment processing services, financial fitness programs, and a small-business loan resource center. Further, the company provides insurance services for property and casualty coverage, such as workers' compensation, business-owner policies, cyber security protection, and commercial auto, as well as health and benefits coverage, including health, dental, vision, and life. It markets and sells its services primarily through its direct sales force. The company was founded in 1971 and is headquartered in Rochester, New York.",44448870400.0,"Paychex, Inc.",2.92,42.195206,0.012195121951219513,1280.4878048780488,113.03,11.328742854800042,11.0,37.15780487804879
350,PRU,Financial Services,United States,0.0475,8.512638,"Prudential Financial, Inc., together with its subsidiaries, provides insurance, investment management, and other financial products and services in the United States and internationally. It operates through eight segments: PGIM, Retirement, Group Insurance, Individual Annuities, Individual Life, Assurance IQ, International Businesses, and Closed Block. The company offers investment management services and solutions related to public fixed income, public equity, real estate debt and equity, private credit and other alternatives, and multi-asset class strategies to institutional and retail clients, as well as its general account. It also provides a range of retirement investment, and income products and services to retirement plan sponsors in the public, private, and not-for-profit sectors; and group life, long-term and short-term group disability, and group corporate-, bank-, and trust-owned life insurance in the United States, primarily to institutional clients for use in connection with employee and membership benefits plans, as well as sells accidental death and dismemberment, and other supplemental health solutions; and provides plan administration services in connection with its insurance coverages. In addition, the company develops and distributes individual variable and fixed annuity products, principally to the mass affluent and affluent markets; and individual variable, term, and universal life insurance products to the mass middle, mass affluent, and affluent markets in the United States. Further, it provides third-party life, health, Medicare, property and casualty, and term life products to retail shoppers through its digital and independent agent channels. The company offers its products and services to individual and institutional customers through its proprietary and third-party distribution networks. Prudential Financial, Inc. was founded in 1875 and is headquartered in Newark, New Jersey.",40737058816.0,"Prudential Financial, Inc.",-0.998,0.0,0.012195121951219513,1280.4878048780488,103.5,12.371862849063273,12.0,38.48780487804877
