index,sector,longBusinessSummary,country,shortName,symbol,trailingEps,forwardPE,marketCap,dividendYield,trailingPE,position_weight,target_allocation,current_price,quantity,order_quantity,rounding_loss
160,Utilities,"Duke Energy Corporation, together with its subsidiaries, operates as an energy company in the United States. It operates through three segments: Electric Utilities and Infrastructure, Gas Utilities and Infrastructure, and Commercial Renewables. The Electric Utilities and Infrastructure segment generates, transmits, distributes, and sells electricity in the Carolinas, Florida, and the Midwest; and uses coal, hydroelectric, natural gas, oil, renewable generation, and nuclear fuel to generate electricity. It also engages in the wholesale of electricity to municipalities, electric cooperative utilities, and load-serving entities. This segment serves approximately 8.2 million customers in 6 states in the Southeast and Midwest regions of the United States covering a service territory of approximately 91,000 square miles; and owns approximately 50,259 megawatts (MW) of generation capacity. The Gas Utilities and Infrastructure segment distributes natural gas to residential, commercial, industrial, and power generation natural gas customers; and owns, operates, and invests in pipeline transmission and natural gas storage facilities. It has approximately 1.6 million customers, including 1.1 million customers in North Carolina, South Carolina, and Tennessee, as well as 550,000 customers in southwestern Ohio and northern Kentucky. The Commercial Renewables segment acquires, owns, develops, builds, and operates wind and solar renewable generation projects, including nonregulated renewable energy and energy storage services to utilities, electric cooperatives, municipalities, and corporate customers. It has 23 wind, 178 solar, and 2 battery storage facilities, as well as 71 fuel cell locations with a capacity of 3,554 MW across 22 states. The company was formerly known as Duke Energy Holding Corp. and changed its name to Duke Energy Corporation in April 2005. The company was founded in 1904 and is headquartered in Charlotte, North Carolina.",United States,Duke Energy Corporation (Holdin,DUK,1.719,18.2789,76641951744.0,0.0442,57.9523,0.02,2702.0,101.82,26.537026124533494,26.0,54.68000000000033
248,Industrials,"Illinois Tool Works Inc. manufactures and sells industrial products and equipment worldwide. It operates through seven segments: Automotive OEM; Food Equipment; Test & Measurement and Electronics; Welding; Polymers & Fluids; Construction Products; and Specialty Products. The Automotive OEM segment offers plastic and metal components, fasteners, and assemblies for automobiles, light trucks, and other industrial uses. The Food Equipment segment provides warewashing, refrigeration, cooking, and food processing equipment; kitchen exhaust, ventilation, and pollution control systems; and food equipment maintenance and repair services. The Test & Measurement and Electronics segment produces and sells equipment, consumables, and related software for testing and measuring of materials and structures, as well as equipment and consumables used in the production of electronic subassemblies and microelectronics. The Welding segment produces arc welding equipment; and metal arc welding consumables and related accessories. The Polymers & Fluids segment produces adhesives, sealants, lubrication and cutting fluids, and fluids and polymers for auto aftermarket maintenance and appearance. The Construction Products segment offers engineered fastening systems and solutions for the residential construction, renovation/remodel, and commercial construction markets. The Specialty Products segment offers beverage packaging equipment and consumables, product coding and marking equipment and consumables, and appliance components and fasteners. It serves the automotive OEM/tiers, commercial food equipment, construction, general industrial, and automotive aftermarket end markets. The company distributes its products directly to industrial manufacturers, as well as through independent distributors. Illinois Tool Works Inc. was founded in 1912 and is based in Glenview, Illinois.",United States,Illinois Tool Works Inc.,ITW,6.969,24.780304,71869333504.0,0.0252,32.855503,0.02,2702.0,226.28,11.940958105002652,11.0,212.92000000000013
0,Industrials,"3M Company operates as a diversified technology company worldwide. It operates through four segments: Safety and Industrial; Transportation and Electronics; Health Care; and Consumer. The Safety and Industrial segment offers industrial abrasives and finishing for metalworking applications; autobody repair solutions; closure systems for personal hygiene products, masking, and packaging materials; electrical products and materials for construction and maintenance, power distribution, and electrical original equipment manufacturers; structural adhesives and tapes; respiratory, hearing, eye, and fall protection solutions; and natural and color-coated mineral granules for shingles. The Transportation and Electronics segment provides ceramic solutions; attachment tapes, films, sound, and temperature management for transportation vehicles; premium large format graphic films for advertising and fleet signage; light management films and electronics assembly solutions; packaging and interconnection solutions; and reflective signage for highway, and vehicle safety. The Healthcare segment offers food safety indicator solutions; health care procedure coding and reimbursement software; skin, wound care, and infection prevention products and solutions; dentistry and orthodontia solutions; and filtration and purification systems. The Consumer segment provides consumer bandages, braces, supports and consumer respirators; cleaning products for the home; retail abrasives, paint accessories, car care DIY products, picture hanging, and consumer air quality solutions; and stationery products. It offers its products through e-commerce and traditional wholesalers, retailers, jobbers, distributors, and dealers. The company was founded in 1902 and is based in St. Paul, Minnesota.",United States,3M Company,MMM,11.46,12.336519,71325949952.0,0.0463,11.260035,0.02,2702.0,120.65,22.395358474927477,22.0,47.700000000000074
423,Utilities,"The Southern Company, through its subsidiaries, engages in the generation, transmission, and distribution of electricity. It operates through Gas Distribution Operations, Gas Pipeline Investments, Wholesale Gas Services, and Gas Marketing Services segments. The company also develops, constructs, acquires, owns, and manages power generation assets, including renewable energy projects and sells electricity in the wholesale market; and distributes natural gas in Illinois, Georgia, Virginia, and Tennessee, as well as provides gas marketing services, wholesale gas services, and gas pipeline investments operations. In addition, it owns and/or operates 30 hydroelectric generating stations, 24 fossil fuel generating stations, three nuclear generating stations, 13 combined cycle/cogeneration stations, 45 solar facilities, 15 wind facilities, one fuel cell facility, and four battery storage facility; and constructs, operates, and maintains 76,289 miles of natural gas pipelines and 14 storage facilities with total capacity of 157 Bcf to provide natural gas to residential, commercial, and industrial customers. The company serves approximately 8.7 million electric and gas utility customers. Further, the company offers digital wireless communications and fiber optics services. The Southern Company was incorporated in 1945 and is headquartered in Atlanta, Georgia.",United States,Southern Company (The),SO,3.18,18.794945,70911221760.0,0.0414,21.040882,0.02,2702.0,67.12,40.25625744934445,40.0,17.199999999999683
457,Financial Services,"U.S. Bancorp, a financial services holding company, provides various financial services to individuals, businesses, institutional organizations, governmental entities and other financial institutions in the United States. It operates in Corporate and Commercial Banking, Consumer and Business Banking, Wealth Management and Investment Services, Payment Services, and Treasury and Corporate Support segments. The company offers depository services, including checking accounts, savings accounts, and time certificate contracts; lending services, such as traditional credit products; and credit card services, lease financing and import/export trade, asset-backed lending, agricultural finance, and other products. It also provides ancillary services comprising capital markets, treasury management, and receivable lock-box collection services to corporate and governmental entity customers; and a range of asset management and fiduciary services for individuals, estates, foundations, business corporations, and charitable organizations. In addition, the company offers investment and insurance products to its customers principally within its markets, as well as fund administration services to a range of mutual and other funds. Further, it provides corporate and purchasing card, and corporate trust services; and merchant processing services, as well as investment management, ATM processing, mortgage banking, insurance, and brokerage and leasing services. As of December 31, 2021, the company provided its products and services through a network of 2,230 banking offices principally operating in the Midwest and West regions of the United States, as well as through on-line services, over mobile devices, and other distribution channels; and operated a network of 4,059 ATMs. The company was founded in 1863 and is headquartered in Minneapolis, Minnesota.",United States,U.S. Bancorp,USB,3.789,10.128146,65628725248.0,0.045300003,11.681182,0.02,2702.0,46.46,58.157554885923375,58.0,7.319999999999996
454,Financial Services,"Truist Financial Corporation, a holding company, provides banking and trust services in the Southeastern and Mid-Atlantic United States. The company operates through three segments: Consumer Banking and Wealth, Corporate and Commercial Banking, and Insurance Holdings. Its deposit products include noninterest-bearing checking, interest-bearing checking, savings, and money market deposit accounts, as well as certificates of deposit and individual retirement accounts. The company also provides funding; asset management; automobile lending; bankcard lending; consumer finance; home equity and mortgage lending; insurance, such as property and casualty, life, health, employee benefits, workers compensation and professional liability, surety coverage, title, and other insurance products; investment brokerage; mobile/online banking; and payment, lease financing, small business lending, and wealth management/private banking services. In addition, it offers association, capital market, institutional trust, insurance premium and commercial finance, international banking, leasing, merchant, commercial deposit and treasury, government finance, commercial middle market lending, small business and student lending, floor plan and commercial mortgage lending, mortgage warehouse lending, private equity investment, real estate lending, and supply chain financing services. Further, the company provides corporate and investment banking, retail and wholesale brokerage, securities underwriting, and investment advisory services. As of December 31, 2021, the company operated through 2,517 banking offices. The company was formerly known as BB&T Corporation and changed its name to Truist Financial Corporation in December 2019. Truist Financial Corporation was founded in 1872 and is headquartered in Charlotte, North Carolina.",United States,Truist Financial Corporation,TFC,4.238,9.654321,62633033728.0,0.0471,11.0712595,0.02,2702.0,47.92,56.38564273789649,56.0,18.479999999999777
204,Consumer Cyclical,"Ford Motor Company designs, manufactures, markets, and services a range of Ford trucks, cars, sport utility vehicles, electrified vehicles, and Lincoln luxury vehicles worldwide. It operates through three segments: Automotive, Mobility, and Ford Credit. The Automotive segment sells Ford and Lincoln vehicles, service parts, and accessories through distributors and dealers, as well as through dealerships to commercial fleet customers, daily rental car companies, and governments. The Mobility segment designs and builds mobility services; and provides self-driving systems development services. The Ford Credit segment primarily engages in vehicle-related financing and leasing activities to and through automotive dealers. It provides retail installment sale contracts for new and used vehicles; and direct financing leases for new vehicles to retail and commercial customers, such as leasing companies, government entities, daily rental companies, and fleet customers. This segment also offers wholesale loans to dealers to finance the purchase of vehicle inventory; and loans to dealers to finance working capital and enhance dealership facilities, purchase dealership real estate, and other dealer vehicle programs. The company has a strategic collaboration with ARB Corporation Limited to develop a suite of aftermarket products for the new Ford Bronco. Ford Motor Company was incorporated in 1903 and is based in Dearborn, Michigan.",United States,Ford Motor Company,F,0.994,8.331361,56267055104.0,0.0468,14.164989,0.02,2702.0,12.4,217.90322580645162,217.0,11.200000000000035
155,Utilities,"Dominion Energy, Inc. produces and distributes energy in the United States. The company operates through four segments: Dominion Energy Virginia, Gas Distribution, Dominion Energy South Carolina, and Contracted Assets. The Dominion Energy Virginia segment generates, transmits, and distributes regulated electricity to approximately 2.7 million residential, commercial, industrial, and governmental customers in Virginia and North Carolina. The Gas Distribution segment is involved in the regulated natural gas sales, transportation, gathering, storage, and distribution operations in Ohio, West Virginia, North Carolina, Utah, southwestern Wyoming, and southeastern Idaho that serve approximately 3.1 million residential, commercial and industrial customers. It also has nonregulated renewable natural gas facilities in operation. The Dominion Energy South Carolina segment generates, transmits, and distributes electricity to approximately 772,000 customers in the central, southern, and southwestern portions of South Carolina; and distributes natural gas to approximately 419,000 residential, commercial, and industrial customers in South Carolina. The Contracted Assets segment is involved in the nonregulated long-term contracted renewable electric generation and solar generation facility development operations; and gas transportation, LNG import, and storage operations, as well as in the liquefaction facility. As of December 31, 2021, the company's portfolio of assets included approximately 30.2 gigawatt of electric generating capacity; 10,700 miles of electric transmission lines; 78,000 miles of electric distribution lines; and 95,700 miles of gas distribution mains and related service facilities. The company was formerly known as Dominion Resources, Inc. Dominion Energy, Inc. was incorporated in 1983 and is headquartered in Richmond, Virginia.",United States,"Dominion Energy, Inc.",D,-0.574,14.934466,49833635840.0,0.0396,,0.02,2702.0,62.42,43.28740788208907,43.0,17.939999999999763
278,Consumer Defensive,"The Kraft Heinz Company, together with its subsidiaries, manufactures and markets food and beverage products in the United States, Canada, the United Kingdom, and internationally. Its products include condiments and sauces, cheese and dairy products, meals, meats, refreshment beverages, coffee, and other grocery products. The company also offers dressings, healthy snacks, and other categories; and spices and other seasonings. It sells its products through its own sales organizations, as well as through independent brokers, agents, and distributors to chain, wholesale, cooperative and independent grocery accounts, convenience stores, drug stores, value stores, bakeries, pharmacies, mass merchants, club stores, and foodservice distributors and institutions, including hotels, restaurants, hospitals, health care facilities, and government agencies; and online through various e-commerce platforms and retailers. The company was formerly known as H.J. Heinz Holding Corporation and changed its name to The Kraft Heinz Company in July 2015. The Kraft Heinz Company was founded in 1869 and is headquartered in Pittsburgh, Pennsylvania.",United States,The Kraft Heinz Company,KHC,0.442,14.624061,47615156224.0,0.0432,88.009056,0.02,2702.0,39.88,67.75325977933801,67.0,30.039999999999807
196,Industrials,"FedEx Corporation provides transportation, e-commerce, and business services in the United States and internationally. The company's FedEx Express segment offers express transportation, small-package ground delivery, and freight transportation services; time-critical transportation services; and cross-border enablement, technology, and e-commerce transportation solutions. Its FedEx Ground segment provides day-certain delivery services to businesses and residences. The company's FedEx Freight segment offers less-than-truckload freight transportation services. As of May 31, 2022, this segment had approximately 30,000 vehicles and 400 service centers. Its FedEx Services segment provides sales, marketing, information technology, communications, customer service, technical support, billing and collection, and back-office support services. The company's Corporate, Other and Eliminations segment offers integrated supply chain management solutions, specialty transportation, customs brokerage, and global ocean and air freight forwarding services; and document and business services, as well as retail access to its customers for its package transportation businesses. FedEx Corporation was founded in 1971 and is based in Memphis, Tennessee.",United States,FedEx Corporation,FDX,11.357,8.955905,46820020224.0,0.0291,15.558685,0.02,2702.0,186.88,14.45847602739726,14.0,85.68000000000005
274,Consumer Defensive,"Kimberly-Clark Corporation, together with its subsidiaries, manufactures and markets personal care and consumer tissue products worldwide. It operates through three segments: Personal Care, Consumer Tissue, and K-C Professional. The Personal Care segment offers disposable diapers, swimpants, training and youth pants, baby wipes, feminine and incontinence care products, and other related products under the Huggies, Pull-Ups, Little Swimmers, GoodNites, DryNites, Sweety, Kotex, U by Kotex, Intimus, Depend, Plenitud, Softex, Poise, and other brand names. The Consumer Tissue segment provides facial and bathroom tissues, paper towels, napkins, and related products under the Kleenex, Scott, Cottonelle, Viva, Andrex, Scottex, Neve, and other brand names. The K-C Professional segment offers wipers, tissues, towels, apparel, soaps, and sanitizers under the Kleenex, Scott, WypAll, Kimtech, and KleenGuard brands. The company sells household use products directly to supermarkets, mass merchandisers, drugstores, warehouse clubs, variety and department stores, and other retail outlets, as well as through other distributors and e-commerce; and away-from-home use products directly to manufacturing, lodging, office building, food service, and public facilities, as well as through distributors and e-commerce. Kimberly-Clark Corporation was founded in 1872 and is headquartered in Dallas, Texas.",United States,Kimberly-Clark Corporation,KMB,6.668,17.027742,45466894336.0,0.038599998,20.250448,0.011627906976744186,1570.9302325581396,135.13,11.625325483298598,11.0,84.5002325581395
364,Industrials,"Paychex, Inc. provides integrated human capital management solutions for human resources (HR), payroll, benefits, and insurance services for small to medium-sized businesses in the United States, Europe, and India. It offers payroll processing services; payroll tax administration services; employee payment services; and regulatory compliance services, such as new-hire reporting and garnishment processing. The company also provides HR solutions, including payroll, employer compliance, HR and employee benefits administration, risk management outsourcing, and the on-site availability of a professionally trained HR representative; and retirement services administration, including plan implementation, ongoing compliance with government regulations, employee and employer reporting, participant and employer online access, electronic funds transfer, and other administrative services. In addition, it offers cloud-based HR administration software products for employee benefits management and administration, time and attendance, digital communication solutions, recruiting, and onboarding solutions; plan administration outsourcing and state unemployment insurance services; various business services to small to medium-sized businesses comprising payroll funding and outsourcing services, which include payroll processing, invoicing, and tax preparation; and payment processing services, financial fitness programs, and a small-business loan resource center. Further, the company provides insurance services for property and casualty coverage, such as workers' compensation, business-owner policies, cyber security protection, and commercial auto, as well as health and benefits coverage, including health, dental, vision, and life. It markets and sells its services primarily through its direct sales force. The company was founded in 1971 and is headquartered in Rochester, New York.",United States,"Paychex, Inc.",PAYX,2.92,38.38318,44448870400.0,0.0274,42.195206,0.011627906976744186,1570.9302325581396,117.93,13.320870283711859,13.0,37.8402325581395
384,Financial Services,"Prudential Financial, Inc., together with its subsidiaries, provides insurance, investment management, and other financial products and services in the United States and internationally. It operates through eight segments: PGIM, Retirement, Group Insurance, Individual Annuities, Individual Life, Assurance IQ, International Businesses, and Closed Block. The company offers investment management services and solutions related to public fixed income, public equity, real estate debt and equity, private credit and other alternatives, and multi-asset class strategies to institutional and retail clients, as well as its general account. It also provides a range of retirement investment, and income products and services to retirement plan sponsors in the public, private, and not-for-profit sectors; and group life, long-term and short-term group disability, and group corporate-, bank-, and trust-owned life insurance in the United States, primarily to institutional clients for use in connection with employee and membership benefits plans, as well as sells accidental death and dismemberment, and other supplemental health solutions; and provides plan administration services in connection with its insurance coverages. In addition, the company develops and distributes individual variable and fixed annuity products, principally to the mass affluent and affluent markets; and individual variable, term, and universal life insurance products to the mass middle, mass affluent, and affluent markets in the United States. Further, it provides third-party life, health, Medicare, property and casualty, and term life products to retail shoppers through its digital and independent agent channels. The company offers its products and services to individual and institutional customers through its proprietary and third-party distribution networks. Prudential Financial, Inc. was founded in 1875 and is headquartered in Newark, New Jersey.",United States,"Prudential Financial, Inc.",PRU,-0.998,8.512638,40737058816.0,0.0475,,0.011627906976744186,1570.9302325581396,98.63,15.927509201643918,15.0,91.48023255813965
418,Real Estate,"Simon is a real estate investment trust engaged in the ownership of premier shopping, dining, entertainment and mixed-use destinations and an S&P 100 company (Simon Property Group, NYSE: SPG). Our properties across North America, Europe and Asia provide community gathering places for millions of people every day and generate billions in annual sales.",United States,"Simon Property Group, Inc.",SPG,3.59,26.411377,39664312320.0,0.066300005,33.62117,0.011627906976744186,1570.9302325581396,123.65,12.704652103179454,12.0,87.13023255813945
