index,symbol,sector,country,dividend_yield,forward_pe,long_business_summary,market_cap,short_name,trailing_eps,trailing_pe,position_weight,target_allocation,current_price,quantity,order_quantity,rounding_loss
305,CAG,Consumer Defensive,United States,0.0369,14.114067,"Conagra Brands, Inc., together with its subsidiaries, operates as a consumer packaged goods food company in North America. The company operates in four segments: Grocery & Snacks, Refrigerated & Frozen, International, and Foodservice. The Grocery & Snacks segment primarily offers shelf stable food products through various retail channels in the United States. The Refrigerated & Frozen segment provides temperature-controlled food products through various retail channels in the United States. The International segment offers food products in various temperature states through retail and foodservice channels outside of the United States. The Foodservice segment offers branded and customized food products, including meals, entrees, sauces, and various custom-manufactured culinary products packaged for restaurants and other foodservice establishments in the United States. The company sells its products under the Birds Eye, Duncan Hines, Healthy Choice, Marie Callender's, Reddi-wip, Slim Jim, Angie's BOOMCHICKAPOP, Duke's, Earth Balance, Gardein, and Frontera brands. The company was formerly known as ConAgra Foods, Inc. and changed its name to Conagra Brands, Inc. in November 2016. Conagra Brands, Inc. was founded in 1919 and is headquartered in Chicago, Illinois.",17806092288.0,"ConAgra Brands, Inc.",2.43,15.27572,0.012195121951219513,1280.4878048780488,36.46,35.12034571799366,35.0,4.387804878048763
342,KEY,Financial Services,United States,0.044099998,9.709184,"KeyCorp operates as the holding company for KeyBank National Association that provides various retail and commercial banking products and services in the United States. It operates in two segments, Consumer Bank and Commercial Bank. The company offers various deposits, investment products and services; and personal finance and financial wellness, student loan refinancing, mortgage and home equity, lending, credit card, treasury, business advisory, wealth management, asset management, investment, cash management, portfolio management, and trust and related services to individuals and small and medium-sized businesses. It also provides a suite of banking and capital market products, such as syndicated finance, debt and equity capital market products, commercial payments, equipment finance, commercial mortgage banking, derivatives, foreign exchange, financial advisory, and public finance, as well as commercial mortgage loans comprising consumer, energy, healthcare, industrial, public sector, real estate, and technology loans for middle market clients. In addition, the company offers community development financing, securities underwriting, brokerage, and investment banking services. As of December 31, 2021, it operated through a network of approximately 999 branches and 1,317 ATMs in 15 states, as well as additional offices, online and mobile banking capabilities, and a telephone banking call center. KeyCorp was founded in 1849 and is headquartered in Cleveland, Ohio.",17718034432.0,KeyCorp,1.768,10.763575,0.012195121951219513,1280.4878048780488,18.99,67.42958424844913,67.0,8.15780487804901
291,GRMN,Technology,Switzerland,0.0344,15.333334,"Garmin Ltd. designs, develops, manufactures, markets, and distributes a range of wireless devices in the Americas, the Asia Pacific, Australian Continent, Europe, the Middle East, and Africa. Its Fitness segment offers running and multi-sport watches; cycling products; activity tracking and smartwatch devices; and fitness and cycling accessories. This segment also provides Garmin Connect and Garmin Connect Mobile, which are web and mobile platforms; and Connect IQ, an application development platform. The company's Outdoor segment offers adventure watches, outdoor handhelds, golf devices and mobile apps, and dog tracking and training devices. Its Aviation segment designs, manufactures, and markets various aircraft avionics solutions comprising integrated flight decks, electronic flight displays and instrumentation, navigation and communication products, automatic flight control systems and safety-enhancing technologies, audio control systems, engine indication systems, traffic awareness and avoidance solutions, ADS-B and transponder solutions, weather information and avoidance solutions, datalink and connectivity solutions, portable GPS navigators and wearables, and various services products. The company's Marine segment provides chartplotters and multi-function displays, cartography products, fish finders, sonar products, autopilot systems, radars, compliant instrument displays and sensors, VHF communication radios, handhelds and wearable devices, sailing products, entertainment, digital switching products, and trolling motors. Its Auto segment offers embedded computing models and infotainment systems; personal navigation devices; and cameras. The company sells its products through independent retailers, online retailers, dealers, distributors, installation and repair shops, and original equipment manufacturers, as well as an online webshop, garmin.com. Garmin Ltd. was founded in 1989 and is based in Schaffhausen, Switzerland.",17516687360.0,Garmin Ltd.,5.468,16.656914,0.012195121951219513,1280.4878048780488,98.69,12.97484856498175,12.0,96.2078048780489
321,OMC,Communication Services,United States,0.0392,12.347895,"Omnicom Group Inc., together with its subsidiaries, provides advertising, marketing, and corporate communications services. It provides a range of services in the areas of advertising, customer relationship management, public relations, and healthcare. The company's services include advertising, branding, content marketing, corporate social responsibility consulting, crisis communications, custom publishing, data analytics, database management, digital/direct marketing, digital transformation, entertainment marketing, experiential marketing, field marketing, financial/corporate business-to-business advertising, graphic arts/digital imaging, healthcare marketing and communications, and in-store design services. Its services also comprise interactive marketing, investor relations, marketing research, media planning and buying, merchandising and point of sale, mobile marketing, multi-cultural marketing, non-profit marketing, organizational communications, package design, product placement, promotional marketing, public affairs, retail marketing, sales support, search engine marketing, shopper marketing, social media marketing, and sports and event marketing services. It operates in the United States, Canada, Puerto Rico, South America, Mexico, Europe, the Middle East, Africa, Australia, Greater China, India, Japan, Korea, New Zealand, Singapore, and other Asian countries. The company was incorporated in 1944 and is based in New York, New York.",16824045568.0,Omnicom Group Inc.,4.51,17.549889,0.012195121951219513,1280.4878048780488,85.28,15.015100901478057,15.0,1.2878048780486995
371,IP,Consumer Cyclical,United States,0.0557,7.1025147,"International Paper Company operates as a packaging company primarily in United States, the Middle East, Europe, Africa, Pacific Rim, Asia, and rest of the Americas. It operates through two segments: Industrial Packaging and Global Cellulose Fibers. The Industrial Packaging segment manufactures containerboards, including linerboard, medium, whitetop, recycled linerboard, recycled medium, and saturating kraft. The Global Cellulose Fibers segment provides fluff, market, and specialty pulps that are used in absorbent hygiene products, such as baby diapers, feminine care, adult incontinence, and other non-woven products; tissue and paper products; and non-absorbent end applications, including textiles, filtration, construction material, paints and coatings, reinforced plastics, and other applications. It sells its products directly to end users and converters, as well as through agents, resellers, and paper distributors. The company was founded in 1898 and is headquartered in Memphis, Tennessee.",14220298240.0,International Paper Company,2.452,14.975532,0.012195121951219513,1280.4878048780488,38.11,33.59978496137625,33.0,22.85780487804893
327,SWK,Industrials,United States,0.0404,6.8717947,"Stanley Black & Decker, Inc. engages in the tools and storage and industrial businesses in the United States, Canada, rest of Americas, France, rest of Europe, and Asia. Its Tools & Storage segment offers professional products, including professional grade corded and cordless electric power tools and equipment, and pneumatic tools and fasteners; and consumer products, such as corded and cordless electric power tools primarily under the BLACK+DECKER brand, as well as corded and cordless lawn and garden products and related accessories; home products; and hand tools, power tool accessories, and storage products. This segment sells its products through retailers, distributors, dealers, and a direct sales force to professional end users, distributors, dealers, retail consumers, and industrial customers in various industries. The company's Industrial segment provides engineered fastening systems and products to customers in the automotive, manufacturing, electronics, construction, aerospace, and other industries; sells and rents custom pipe handling, joint welding, and coating equipment for use in the construction of large and small diameter pipelines, as well as provides pipeline inspection services; and sells hydraulic tools and performance-driven heavy equipment attachment tools. This segment serves oil and natural gas pipeline industry and other industrial customers. It also sells automatic doors to commercial customers. The company was formerly known as The Stanley Works and changed its name to Stanley Black & Decker, Inc. in March 2010. Stanley Black & Decker, Inc. was founded in 1843 and is headquartered in New Britain, Connecticut.",13544780800.0,"Stanley Black & Decker, Inc.",9.844,8.439659,0.012195121951219513,1280.4878048780488,86.16,14.861743324954142,14.0,74.24780487804891
380,VFC,Consumer Cyclical,United States,0.0709,11.48495,"V.F. Corporation, together with its subsidiaries, engages in the design, procurement, marketing, and distribution of branded lifestyle apparel, footwear, and related products for men, women, and children in the Americas, Europe, and the Asia-Pacific. It operates through three segments: Outdoor, Active, and Work. The company offers outdoor, merino wool and other natural fibers-based, lifestyle, and casual apparel; footwear; equipment; accessories; outdoor-inspired, performance-based, youth culture/action sports-inspired, streetwear, and protective work footwear; handbags, luggage, backpacks, and totes; and work and work-inspired lifestyle apparel and footwear. It provides its products under the North Face, Timberland, Smartwool, Icebreaker, Altra, Vans, Supreme, Kipling, Napapijri, Eastpak, JanSport, Dickies, and Timberland PRO brand names. The company sells its products primarily to specialty stores, department stores, national chains, and mass merchants, as well as sells through direct-to-consumer operations, including retail stores, concession retail stores, and e-commerce sites, and other digital platforms. V.F. Corporation was founded in 1899 and is headquartered in Denver, Colorado.",13488134144.0,V.F. Corporation,-0.426,0.0,0.012195121951219513,1280.4878048780488,30.45,42.05214465937763,42.0,1.5878048780488883
355,VTRS,Healthcare,United States,0.049099997,2.9946237,"Viatris Inc. operates as a healthcare company worldwide. The company operates in four segments: Developed Markets, Greater China, JANZ, and Emerging Markets. It offers prescription brand drugs, generic drugs, complex generic drugs, biosimilars, and active pharmaceutical ingredients (APIs). The company offers drugs in various therapeutic areas, including noncommunicable and infectious diseases; biosimilars in the areas of oncology, immunology, endocrinology, ophthalmology, and dermatology; and APIs for antibacterial, central nervous system agents, antihistamines/antiasthmatics, cardiovascular, antivirals, antidiabetics, antifungals, and proton pump inhibitor areas, as well as support services, such as diagnostic clinics, educational seminars, and digital tools to help patients better manage their health. It provides its medicines in the form of oral solid doses, injectables, complex dosage forms, and APIs to retail and pharmacy establishments, wholesalers and distributors, payers, insurers and governments, and institutions. The company distributes its products through pharmaceutical wholesalers/distributors, pharmaceutical retailers, institutional pharmacies, mail-order and e-commerce pharmacies, and specialty pharmacies. It sells its products under the Lyrica, Lipitor, Creon, Influvac, Wixela Inhub, EpiPen auto-injector, Fraxiparine, and Yupelri; Norvasc and Viagra; AMITIZA, Lipacreon, and Effexor; and Celebrex and ARV names, as well as offers biosimilars franchises, including Fulphila, Ogivri, Hulio, and SEMGLEE. The company has collaboration and licensing agreements with Revance Therapeutics, Inc.; Momenta Pharmaceuticals, Inc.; Theravance Biopharma, Inc.; Biocon Ltd.; and Fujifilm Kyowa Kirin Biologics Co. Ltd. Viatris Inc. was founded in 1961 and is headquartered in Canonsburg, Pennsylvania.",13472604160.0,Viatris Inc.,-1.715,0.0,0.012195121951219513,1280.4878048780488,11.89,107.69451681060124,107.0,8.257804878048782
358,BEN,Financial Services,United States,0.0498,8.161586,"Franklin Resources, Inc. is a publicly owned asset management holding company. Through its subsidiaries, the firm provides its services to individuals, institutions, pension plans, trusts, and partnerships. It launches equity, fixed income, balanced, and multi-asset mutual funds through its subsidiaries. The firm invests in the public equity, fixed income, and alternative markets. Franklin Resources, Inc. was founded in 1947 and is based in San Mateo, California with an additional office in Hyderabad, India.",13433052160.0,"Franklin Resources, Inc.",1.558,17.182285,0.012195121951219513,1280.4878048780488,30.72,41.68254573170732,41.0,20.96780487804892
229,SNA,Industrials,United States,0.026300002,17.279715,"Snap-on Incorporated manufactures and markets tools, equipment, diagnostics, and repair information and systems solutions for professional users worldwide. It operates through Commercial & Industrial Group, Snap-on Tools Group, Repair Systems & Information Group, and Financial Services segments. The company offers hand tools, including wrenches, sockets, ratchet wrenches, pliers, screwdrivers, punches and chisels, saws and cutting tools, pruning tools, torque measuring instruments, and other products; power tools, such as cordless, pneumatic, hydraulic, and corded tools; and tool storage products comprising tool chests, roll cabinets, and other products. It also provides handheld and computer-based diagnostic products, service and repair information products, diagnostic software solutions, electronic parts catalogs, business management systems and services, point-of-sale systems, integrated systems for vehicle service shops, original equipment manufacturer purchasing facilitation services, and warranty management systems and analytics. In addition, the company offers solutions for the service of vehicles and industrial equipment that include wheel alignment equipment, wheel balancers, tire changers, vehicle lifts, test lane equipment, collision repair equipment, vehicle air conditioning service equipment, brake service equipment, fluid exchange equipment, transmission troubleshooting equipment, safety testing equipment, battery chargers, and hoists, as well as after-sales support services and training programs. Further, it provides financing programs to facilitate the sales of its products and support its franchise business. The company serves the aviation and aerospace, agriculture, construction, government and military, mining, natural resources, power generation, and technical education industries, as well as vehicle dealerships and repair centers. Snap-on Incorporated was founded in 1920 and is based in Kenosha, Wisconsin.",12997227520.0,Snap-On Incorporated,12.455,19.492573,0.012195121951219513,1280.4878048780488,244.45,5.238240150861317,5.0,58.23780487804883
337,PKG,Consumer Cyclical,United States,0.043,16.295343,"Packaging Corporation of America manufactures and sells containerboard and corrugated packaging products in the United States. The company operates through Packaging and Paper segments. The Packaging segment offers various containerboard and corrugated packaging products, such as conventional shipping containers used to protect and transport manufactured goods; multi-color boxes and displays that help to merchandise the packaged product in retail locations; and honeycomb protective packaging products, as well as packaging for meat, fresh fruit and vegetables, processed food, beverages, and other industrial and consumer products. This segment sells its corrugated products through a direct sales and marketing organization, independent brokers, and distribution partners. The Paper segment manufactures and sells commodity and specialty papers, as well as communication papers, including cut-size office papers, and printing and converting papers. This segment sells white papers through its sales and marketing organization. Packaging Corporation of America was founded in 1867 and is headquartered in Lake Forest, Illinois.",12630926336.0,Packaging Corporation of Americ,5.101,26.067438,0.012195121951219513,1280.4878048780488,138.41,9.251411060458413,9.0,34.79780487804888
364,STX,Technology,Ireland,0.052399997,8.152012,"Seagate Technology Holdings plc provides data storage technology and solutions in Singapore, the United States, the Netherlands, and internationally. It provides mass capacity storage products, including enterprise nearline hard disk drives (HDDs), enterprise nearline solid state drives (SSDs), enterprise nearline systems, video and image HDDs, and network-attached storage drives. The company also offers legacy applications comprising Mission Critical HDDs and SSDs; external storage solutions under the Seagate Ultra Touch, One Touch, and Expansion product lines, as well as under the LaCie brand name; desktop drives; notebook drives, DVR HDDs, and gaming SSDs. In addition, it provides Lyve edge-to-cloud mass capacity platform. The company sells its products primarily to OEMs, distributors, and retailers. Seagate Technology Holdings plc was founded in 1978 and is based in Dublin, Ireland.",12178189312.0,Seagate Technology Holdings PLC,3.957,13.823604,0.012195121951219513,1280.4878048780488,68.99,18.56048419884112,18.0,38.667804878048884
325,EMN,Basic Materials,United States,0.0401,9.600441,"Eastman Chemical Company operates as a specialty materials company in the United States and internationally. The company's Additives & Functional Products segment offers hydrocarbon and rosin resins; organic acid-based solutions; amine derivative-based building blocks; metam-based soil fumigants, thiram and ziram based fungicides, and plant growth regulators; specialty coalescent, specialty and commodity solvents, paint additives, and specialty polymers; heat transfer and aviation fluids; insoluble sulfur and anti-degradant rubber additives; and performance resins. It serves transportation, personal care, wellness, food, feed, agriculture, building and construction, water treatment, energy, consumables, durables, and electronics markets. Its Advanced Materials segment provides copolyesters, cellulosic biopolymers, cellulose esters, polyvinyl butyral (PVB) sheets, and window and protective films, and aftermarket applied film products for value-added end uses in the transportation, durables, electronics, building and construction, medical and pharma, and consumables markets. The company's Chemical Intermediates segment offers methylamines and salts higher amines and solvents; Olefin and acetyl derivatives, ethylene, and commodity solvents; and primary non-phthalate and phthalate plasticizers, and niche non- phthalate plasticizers to the industrial chemicals and processing, building and construction, health and wellness, and agrochemicals. Its Fibers segment provides cellulose acetate tow, triacetin, cellulose acetate flake, acetic acid, and acetic anhydride for use in filtration media primarily cigarette filters; natural and solution dyed acetate yarns for use in consumables, and health and wellness markets; and wet-laid nonwoven media, specialty and engineered papers, and cellulose acetate fibers for transportation, industrial, agriculture and mining, and aerospace markets. Eastman Chemical Company was founded in 1920 and is headquartered in Kingsport, Tennessee.",11693591552.0,Eastman Chemical Company,3.609,24.10086,0.012195121951219513,1280.4878048780488,86.82,14.748765317646267,14.0,65.00780487804892
362,WHR,Consumer Cyclical,United States,0.051999997,6.404219,"Whirlpool Corporation manufactures and markets home appliances and related products. It operates through four segments: North America; Europe, Middle East and Africa; Latin America; and Asia. The company's principal products include refrigerators, freezers, ice makers, and refrigerator water filters; laundry appliances and related laundry accessories; cooking and other small domestic appliances; and dishwasher appliances and related accessories, as well as mixers. It markets and distributes its products primarily under the Whirlpool, Maytag, KitchenAid, JennAir, Amana, Roper, Affresh, Gladiator, Swash, everydrop, Speed Queen, Hotpoint, Bauknecht, Indesit, Ignis, Privileg, Consul, Eslabon de Lujo, Brastemp, Acros, Ariston, Diqua, and Royalstar brands. The company sells its products to retailers, distributors, dealers, builders, and other manufacturers, as well as directly to consumers. Whirlpool Corporation was founded in 1911 and is headquartered in Benton Harbor, Michigan.",9036750848.0,Whirlpool Corporation,21.436,6.940194,0.012195121951219513,1280.4878048780488,154.1,8.309460122505184,8.0,47.687804878048894
357,IVZ,Financial Services,United States,0.0498,6.557432,"Invesco Ltd. is a publicly owned investment manager. The firm provides its services to retail clients, institutional clients, high-net worth clients, public entities, corporations, unions, non-profit organizations, endowments, foundations, pension funds, financial institutions, and sovereign wealth funds. It manages separate client-focused equity and fixed income portfolios. The firm also launches equity, fixed income, commodity, multi-asset, and balanced mutual funds for its clients. It launches equity, fixed income, multi-asset, and balanced exchange-traded funds. The firm also launches and manages private funds. It invests in the public equity and fixed income markets across the globe. The firm also invests in alternative markets, such as commodities and currencies. For the equity portion of its portfolio, it invests in growth and value stocks of large-cap, mid-cap, and small-cap companies. For the fixed income portion of its portfolio, the firm invests in convertibles, government bonds, municipal bonds, treasury securities, and cash. It also invests in short term and intermediate term bonds, investment grade and high yield bonds, taxable and tax-free bonds, senior secured loans, and structured securities such as asset-backed securities, mortgage-backed securities, and commercial mortgage-backed securities. The firm employs absolute return, global macro, and long/short strategies. It employs quantitative analysis to make its investments. The firm was formerly known as Invesco Plc, AMVESCAP plc, Amvesco plc, Invesco PLC, Invesco MIM, and H. Lotery & Co. Ltd. Invesco Ltd. was founded in December 1935 and is based in Atlanta, Georgia with an additional office in Hamilton, Bermuda.",8952028160.0,Invesco Ltd,1.529,12.6945715,0.012195121951219513,1280.4878048780488,18.3,69.97201119552179,69.0,17.78780487804871
365,PNW,Utilities,United States,0.052399997,14.941406,"Pinnacle West Capital Corporation, through its subsidiary, Arizona Public Service Company, provides retail and wholesale electric services primarily in the state of Arizona. The company engages in the generation, transmission, and distribution of electricity using coal, nuclear, gas, oil, and solar generating facilities. Its transmission facilities include approximately 5,814 pole miles of overhead lines and approximately 74 miles of underground lines; and distribution facilities comprise approximately 11,258 miles of overhead lines and approximately 22,821 miles of underground primary cable, as well as owns and maintains 475 transmission and distribution substations. The company also owns or leases approximately 6,323 megawatts of regulated generation capacity. It serves approximately 1.3 million customers. Pinnacle West Capital Corporation was incorporated in 1985 and is headquartered in Phoenix, Arizona.",8630653952.0,Pinnacle West Capital Corporati,4.87,15.708419,0.012195121951219513,1280.4878048780488,74.07,17.28753618034358,17.0,21.297804878048925
