index,sector,longBusinessSummary,country,shortName,symbol,trailingEps,forwardPE,marketCap,dividendYield,trailingPE,position_weight,target_allocation,current_price,quantity,order_quantity,rounding_loss
272,Financial Services,"KeyCorp operates as the holding company for KeyBank National Association that provides various retail and commercial banking products and services in the United States. It operates in two segments, Consumer Bank and Commercial Bank. The company offers various deposits, investment products and services; and personal finance and financial wellness, student loan refinancing, mortgage and home equity, lending, credit card, treasury, business advisory, wealth management, asset management, investment, cash management, portfolio management, and trust and related services to individuals and small and medium-sized businesses. It also provides a suite of banking and capital market products, such as syndicated finance, debt and equity capital market products, commercial payments, equipment finance, commercial mortgage banking, derivatives, foreign exchange, financial advisory, and public finance, as well as commercial mortgage loans comprising consumer, energy, healthcare, industrial, public sector, real estate, and technology loans for middle market clients. In addition, the company offers community development financing, securities underwriting, brokerage, and investment banking services. As of December 31, 2021, it operated through a network of approximately 999 branches and 1,317 ATMs in 15 states, as well as additional offices, online and mobile banking capabilities, and a telephone banking call center. KeyCorp was founded in 1849 and is headquartered in Cleveland, Ohio.",United States,KeyCorp,KEY,1.768,9.709184,17718034432.0,0.044099998,10.763575,0.011627906976744186,1570.9302325581396,17.44,90.07627480264561,90.0,1.3302325581395031
354,Communication Services,"Omnicom Group Inc., together with its subsidiaries, provides advertising, marketing, and corporate communications services. It provides a range of services in the areas of advertising, customer relationship management, public relations, and healthcare. The company's services include advertising, branding, content marketing, corporate social responsibility consulting, crisis communications, custom publishing, data analytics, database management, digital/direct marketing, digital transformation, entertainment marketing, experiential marketing, field marketing, financial/corporate business-to-business advertising, graphic arts/digital imaging, healthcare marketing and communications, and in-store design services. Its services also comprise interactive marketing, investor relations, marketing research, media planning and buying, merchandising and point of sale, mobile marketing, multi-cultural marketing, non-profit marketing, organizational communications, package design, product placement, promotional marketing, public affairs, retail marketing, sales support, search engine marketing, shopper marketing, social media marketing, and sports and event marketing services. It operates in the United States, Canada, Puerto Rico, South America, Mexico, Europe, the Middle East, Africa, Australia, Greater China, India, Japan, Korea, New Zealand, Singapore, and other Asian countries. The company was incorporated in 1944 and is based in New York, New York.",United States,Omnicom Group Inc.,OMC,4.51,12.347895,16824045568.0,0.0392,17.549889,0.011627906976744186,1570.9302325581396,83.78,18.750659257079725,18.0,62.89023255813938
262,Real Estate,"Iron Mountain Incorporated (NYSE: IRM), founded in 1951, is the global leader for storage and information management services. Trusted by more than 225,000 organizations around the world, and with a real estate network of more than 90 million square feet across approximately 1,450 facilities in approximately 50 countries, Iron Mountain stores and protects billions of valued assets, including critical business information, highly sensitive data, and cultural and historical artifacts. Providing solutions that include secure records storage, information management, digital transformation, secure destruction, as well as data centers, cloud services and art storage and logistics, Iron Mountain helps customers lower cost and risk, comply with regulations, recover from disaster, and enable a more digital way of working.",United States,Iron Mountain Incorporated (Del,IRM,1.189,37.454548,15508298752.0,0.0502,45.046257,0.011627906976744186,1570.9302325581396,51.82,30.315133781515623,30.0,16.330232558139596
254,Consumer Cyclical,"International Paper Company operates as a packaging company primarily in United States, the Middle East, Europe, Africa, Pacific Rim, Asia, and rest of the Americas. It operates through two segments: Industrial Packaging and Global Cellulose Fibers. The Industrial Packaging segment manufactures containerboards, including linerboard, medium, whitetop, recycled linerboard, recycled medium, and saturating kraft. The Global Cellulose Fibers segment provides fluff, market, and specialty pulps that are used in absorbent hygiene products, such as baby diapers, feminine care, adult incontinence, and other non-woven products; tissue and paper products; and non-absorbent end applications, including textiles, filtration, construction material, paints and coatings, reinforced plastics, and other applications. It sells its products directly to end users and converters, as well as through agents, resellers, and paper distributors. The company was founded in 1898 and is headquartered in Memphis, Tennessee.",United States,International Paper Company,IP,2.452,7.1025147,14220298240.0,0.0557,14.975532,0.011627906976744186,1570.9302325581396,37.53,41.857986479033826,41.0,32.200232558139504
229,Real Estate,"Healthpeak Properties, Inc. is a fully integrated real estate investment trust (REIT) and S&P 500 company. Healthpeak owns and develops high-quality real estate in the three private-pay healthcare asset classes of Life Science, Medical Office and Senior Housing, designed to provide stability through the inevitable industry cycles. At Healthpeak, we pair our deep understanding of the healthcare real estate market with a strong vision for long-term growth.",United States,"Healthpeak Properties, Inc.",PEAK,1.145,68.81081,13724772352.0,0.052199997,22.235807,0.011627906976744186,1570.9302325581396,26.85,58.50764367069421,58.0,13.630232558139474
255,Communication Services,"The Interpublic Group of Companies, Inc. provides advertising and marketing services worldwide. It operates in two segments, Integrated Agency Networks (IAN) and IPG DXTRA. The company offers consumer advertising, digital marketing, communications planning and media buying, public relations, and specialized communications disciplines, as well as data science services. It also provides various diversified services, including meeting and event production, sports and entertainment marketing, corporate and brand identity, and strategic marketing consulting. The company was formerly known as McCann-Erickson Incorporated and changed its name to The Interpublic Group of Companies, Inc. in January 1961. The Interpublic Group of Companies, Inc. was founded in 1902 and is headquartered in New York, New York.",United States,"Interpublic Group of Companies,",IPG,1.109,14.74359,13584547840.0,0.0385,31.109108,0.011627906976744186,1570.9302325581396,36.25,43.33600641539695,43.0,12.180232558139501
425,Industrials,"Stanley Black & Decker, Inc. engages in the tools and storage and industrial businesses in the United States, Canada, rest of Americas, France, rest of Europe, and Asia. Its Tools & Storage segment offers professional products, including professional grade corded and cordless electric power tools and equipment, and pneumatic tools and fasteners; and consumer products, such as corded and cordless electric power tools primarily under the BLACK+DECKER brand, as well as corded and cordless lawn and garden products and related accessories; home products; and hand tools, power tool accessories, and storage products. This segment sells its products through retailers, distributors, dealers, and a direct sales force to professional end users, distributors, dealers, retail consumers, and industrial customers in various industries. The company's Industrial segment provides engineered fastening systems and products to customers in the automotive, manufacturing, electronics, construction, aerospace, and other industries; sells and rents custom pipe handling, joint welding, and coating equipment for use in the construction of large and small diameter pipelines, as well as provides pipeline inspection services; and sells hydraulic tools and performance-driven heavy equipment attachment tools. This segment serves oil and natural gas pipeline industry and other industrial customers. It also sells automatic doors to commercial customers. The company was formerly known as The Stanley Works and changed its name to Stanley Black & Decker, Inc. in March 2010. Stanley Black & Decker, Inc. was founded in 1843 and is headquartered in New Britain, Connecticut.",United States,"Stanley Black & Decker, Inc.",SWK,9.844,6.8717947,13544780800.0,0.0404,8.439659,0.011627906976744186,1570.9302325581396,85.83,18.302810585554464,18.0,25.990232558139688
472,Consumer Cyclical,"V.F. Corporation, together with its subsidiaries, engages in the design, procurement, marketing, and distribution of branded lifestyle apparel, footwear, and related products for men, women, and children in the Americas, Europe, and the Asia-Pacific. It operates through three segments: Outdoor, Active, and Work. The company offers outdoor, merino wool and other natural fibers-based, lifestyle, and casual apparel; footwear; equipment; accessories; outdoor-inspired, performance-based, youth culture/action sports-inspired, streetwear, and protective work footwear; handbags, luggage, backpacks, and totes; and work and work-inspired lifestyle apparel and footwear. It provides its products under the North Face, Timberland, Smartwool, Icebreaker, Altra, Vans, Supreme, Kipling, Napapijri, Eastpak, JanSport, Dickies, and Timberland PRO brand names. The company sells its products primarily to specialty stores, department stores, national chains, and mass merchants, as well as sells through direct-to-consumer operations, including retail stores, concession retail stores, and e-commerce sites, and other digital platforms. V.F. Corporation was founded in 1899 and is headquartered in Denver, Colorado.",United States,V.F. Corporation,VFC,-0.426,11.48495,13488134144.0,0.0709,,0.011627906976744186,1570.9302325581396,29.34,53.54227104833468,53.0,15.910232558139608
473,Healthcare,"Viatris Inc. operates as a healthcare company worldwide. The company operates in four segments: Developed Markets, Greater China, JANZ, and Emerging Markets. It offers prescription brand drugs, generic drugs, complex generic drugs, biosimilars, and active pharmaceutical ingredients (APIs). The company offers drugs in various therapeutic areas, including noncommunicable and infectious diseases; biosimilars in the areas of oncology, immunology, endocrinology, ophthalmology, and dermatology; and APIs for antibacterial, central nervous system agents, antihistamines/antiasthmatics, cardiovascular, antivirals, antidiabetics, antifungals, and proton pump inhibitor areas, as well as support services, such as diagnostic clinics, educational seminars, and digital tools to help patients better manage their health. It provides its medicines in the form of oral solid doses, injectables, complex dosage forms, and APIs to retail and pharmacy establishments, wholesalers and distributors, payers, insurers and governments, and institutions. The company distributes its products through pharmaceutical wholesalers/distributors, pharmaceutical retailers, institutional pharmacies, mail-order and e-commerce pharmacies, and specialty pharmacies. It sells its products under the Lyrica, Lipitor, Creon, Influvac, Wixela Inhub, EpiPen auto-injector, Fraxiparine, and Yupelri; Norvasc and Viagra; AMITIZA, Lipacreon, and Effexor; and Celebrex and ARV names, as well as offers biosimilars franchises, including Fulphila, Ogivri, Hulio, and SEMGLEE. The company has collaboration and licensing agreements with Revance Therapeutics, Inc.; Momenta Pharmaceuticals, Inc.; Theravance Biopharma, Inc.; Biocon Ltd.; and Fujifilm Kyowa Kirin Biologics Co. Ltd. Viatris Inc. was founded in 1961 and is headquartered in Canonsburg, Pennsylvania.",United States,Viatris Inc.,VTRS,-1.715,2.9946237,13472604160.0,0.049099997,,0.011627906976744186,1570.9302325581396,11.6,135.42502004811547,135.0,4.930232558139459
210,Financial Services,"Franklin Resources, Inc. is a publicly owned asset management holding company. Through its subsidiaries, the firm provides its services to individuals, institutions, pension plans, trusts, and partnerships. It launches equity, fixed income, balanced, and multi-asset mutual funds through its subsidiaries. The firm invests in the public equity, fixed income, and alternative markets. Franklin Resources, Inc. was founded in 1947 and is based in San Mateo, California with an additional office in Hyderabad, India.",United States,"Franklin Resources, Inc.",BEN,1.558,8.161586,13433052160.0,0.0498,17.182285,0.011627906976744186,1570.9302325581396,30.04,52.294614932028615,52.0,8.850232558139604
421,Industrials,"Snap-on Incorporated manufactures and markets tools, equipment, diagnostics, and repair information and systems solutions for professional users worldwide. It operates through Commercial & Industrial Group, Snap-on Tools Group, Repair Systems & Information Group, and Financial Services segments. The company offers hand tools, including wrenches, sockets, ratchet wrenches, pliers, screwdrivers, punches and chisels, saws and cutting tools, pruning tools, torque measuring instruments, and other products; power tools, such as cordless, pneumatic, hydraulic, and corded tools; and tool storage products comprising tool chests, roll cabinets, and other products. It also provides handheld and computer-based diagnostic products, service and repair information products, diagnostic software solutions, electronic parts catalogs, business management systems and services, point-of-sale systems, integrated systems for vehicle service shops, original equipment manufacturer purchasing facilitation services, and warranty management systems and analytics. In addition, the company offers solutions for the service of vehicles and industrial equipment that include wheel alignment equipment, wheel balancers, tire changers, vehicle lifts, test lane equipment, collision repair equipment, vehicle air conditioning service equipment, brake service equipment, fluid exchange equipment, transmission troubleshooting equipment, safety testing equipment, battery chargers, and hoists, as well as after-sales support services and training programs. Further, it provides financing programs to facilitate the sales of its products and support its franchise business. The company serves the aviation and aerospace, agriculture, construction, government and military, mining, natural resources, power generation, and technical education industries, as well as vehicle dealerships and repair centers. Snap-on Incorporated was founded in 1920 and is based in Kenosha, Wisconsin.",United States,Snap-On Incorporated,SNA,12.455,17.279715,12997227520.0,0.026300002,19.492573,0.011627906976744186,1570.9302325581396,238.41,6.589196059553457,6.0,140.4702325581396
361,Consumer Cyclical,"Packaging Corporation of America manufactures and sells containerboard and corrugated packaging products in the United States. The company operates through Packaging and Paper segments. The Packaging segment offers various containerboard and corrugated packaging products, such as conventional shipping containers used to protect and transport manufactured goods; multi-color boxes and displays that help to merchandise the packaged product in retail locations; and honeycomb protective packaging products, as well as packaging for meat, fresh fruit and vegetables, processed food, beverages, and other industrial and consumer products. This segment sells its corrugated products through a direct sales and marketing organization, independent brokers, and distribution partners. The Paper segment manufactures and sells commodity and specialty papers, as well as communication papers, including cut-size office papers, and printing and converting papers. This segment sells white papers through its sales and marketing organization. Packaging Corporation of America was founded in 1867 and is headquartered in Lake Forest, Illinois.",United States,Packaging Corporation of Americ,PKG,5.101,16.295343,12630926336.0,0.043,26.067438,0.011627906976744186,1570.9302325581396,132.48,11.857867093584991,11.0,113.6502325581396
163,Basic Materials,"Eastman Chemical Company operates as a specialty materials company in the United States and internationally. The company's Additives & Functional Products segment offers hydrocarbon and rosin resins; organic acid-based solutions; amine derivative-based building blocks; metam-based soil fumigants, thiram and ziram based fungicides, and plant growth regulators; specialty coalescent, specialty and commodity solvents, paint additives, and specialty polymers; heat transfer and aviation fluids; insoluble sulfur and anti-degradant rubber additives; and performance resins. It serves transportation, personal care, wellness, food, feed, agriculture, building and construction, water treatment, energy, consumables, durables, and electronics markets. Its Advanced Materials segment provides copolyesters, cellulosic biopolymers, cellulose esters, polyvinyl butyral (PVB) sheets, and window and protective films, and aftermarket applied film products for value-added end uses in the transportation, durables, electronics, building and construction, medical and pharma, and consumables markets. The company's Chemical Intermediates segment offers methylamines and salts higher amines and solvents; Olefin and acetyl derivatives, ethylene, and commodity solvents; and primary non-phthalate and phthalate plasticizers, and niche non- phthalate plasticizers to the industrial chemicals and processing, building and construction, health and wellness, and agrochemicals. Its Fibers segment provides cellulose acetate tow, triacetin, cellulose acetate flake, acetic acid, and acetic anhydride for use in filtration media primarily cigarette filters; natural and solution dyed acetate yarns for use in consumables, and health and wellness markets; and wet-laid nonwoven media, specialty and engineered papers, and cellulose acetate fibers for transportation, industrial, agriculture and mining, and aerospace markets. Eastman Chemical Company was founded in 1920 and is headquartered in Kingsport, Tennessee.",United States,Eastman Chemical Company,EMN,3.609,9.600441,11693591552.0,0.0401,24.10086,0.011627906976744186,1570.9302325581396,89.82,17.489759881520147,17.0,43.990232558139596
75,Real Estate,"Boston Properties (NYSE:BXP) is the largest publicly-held developer and owner of Class A office properties in the United States, concentrated in five markets - Boston, Los Angeles, New York, San Francisco and Washington, DC. The Company is a fully integrated real estate company, organized as a real estate investment trust (REIT), that develops, manages, operates, acquires and owns a diverse portfolio of primarily Class A office space. The Company's portfolio totals 51.2 million square feet and 196 properties, including six properties under construction/redevelopment.",United States,"Boston Properties, Inc.",BXP,2.927,23.725166,11192231936.0,0.0553,24.478989,0.011627906976744186,1570.9302325581396,71.2,22.06362686177162,22.0,4.530232558139377
491,Consumer Cyclical,"Whirlpool Corporation manufactures and markets home appliances and related products. It operates through four segments: North America; Europe, Middle East and Africa; Latin America; and Asia. The company's principal products include refrigerators, freezers, ice makers, and refrigerator water filters; laundry appliances and related laundry accessories; cooking and other small domestic appliances; and dishwasher appliances and related accessories, as well as mixers. It markets and distributes its products primarily under the Whirlpool, Maytag, KitchenAid, JennAir, Amana, Roper, Affresh, Gladiator, Swash, everydrop, Speed Queen, Hotpoint, Bauknecht, Indesit, Ignis, Privileg, Consul, Eslabon de Lujo, Brastemp, Acros, Ariston, Diqua, and Royalstar brands. The company sells its products to retailers, distributors, dealers, builders, and other manufacturers, as well as directly to consumers. Whirlpool Corporation was founded in 1911 and is headquartered in Benton Harbor, Michigan.",United States,Whirlpool Corporation,WHR,21.436,6.404219,9036750848.0,0.051999997,6.940194,0.011627906976744186,1570.9302325581396,150.82,10.415927811683726,10.0,62.73023255813961
259,Financial Services,"Invesco Ltd. is a publicly owned investment manager. The firm provides its services to retail clients, institutional clients, high-net worth clients, public entities, corporations, unions, non-profit organizations, endowments, foundations, pension funds, financial institutions, and sovereign wealth funds. It manages separate client-focused equity and fixed income portfolios. The firm also launches equity, fixed income, commodity, multi-asset, and balanced mutual funds for its clients. It launches equity, fixed income, multi-asset, and balanced exchange-traded funds. The firm also launches and manages private funds. It invests in the public equity and fixed income markets across the globe. The firm also invests in alternative markets, such as commodities and currencies. For the equity portion of its portfolio, it invests in growth and value stocks of large-cap, mid-cap, and small-cap companies. For the fixed income portion of its portfolio, the firm invests in convertibles, government bonds, municipal bonds, treasury securities, and cash. It also invests in short term and intermediate term bonds, investment grade and high yield bonds, taxable and tax-free bonds, senior secured loans, and structured securities such as asset-backed securities, mortgage-backed securities, and commercial mortgage-backed securities. The firm employs absolute return, global macro, and long/short strategies. It employs quantitative analysis to make its investments. The firm was formerly known as Invesco Plc, AMVESCAP plc, Amvesco plc, Invesco PLC, Invesco MIM, and H. Lotery & Co. Ltd. Invesco Ltd. was founded in December 1935 and is based in Atlanta, Georgia with an additional office in Hamilton, Bermuda.",United States,Invesco Ltd,IVZ,1.529,6.557432,8952028160.0,0.0498,12.6945715,0.011627906976744186,1570.9302325581396,18.97,82.81129322921137,82.0,15.390232558139736
10,Consumer Cyclical,"Advance Auto Parts, Inc. provides automotive replacement parts, accessories, batteries, and maintenance items for domestic and imported cars, vans, sport utility vehicles, and light and heavy duty trucks. The company offers battery accessories; belts and hoses; brakes and brake pads; chassis and climate control parts; clutches and drive shafts; engines and engine parts; exhaust systems and parts; hub assemblies; ignition components and wires; radiators and cooling parts; starters and alternators; and steering and alignment parts. It also offers air conditioning chemicals and accessories; air fresheners; antifreeze and washer fluids; electrical wires and fuses; electronics; floor mats, seat covers, and interior accessories; hand and specialty tools; lighting products; performance parts; sealants, adhesives and compounds; tire repair accessories; vent shades, mirrors and exterior accessories; washes, waxes and cleaning supplies; and wiper blades. In addition, the company offers air filters; fuel and oil additives; fuel filters; grease and lubricants; motor oils; oil filters, part cleaners and treatments; and transmission fluids for engine maintenance. Further, it offers battery and wiper installation; engine light scanning and checking; electrical system testing; video clinic; oil and battery recycling; and loaner tool program services. Additionally, the company sells its products through its website. It serves professional installers and do-it-yourself customers. The company operates stores under the Advance Auto Parts, Autopart International, and Carquest brands, as well as branches under the Worldpac name. As of April 23, 2022, it operated 4,687 stores and 311 branches in the United States, Puerto Rico, the U.S. Virgin Islands, and Canada; and served 1,318 independently owned Carquest branded stores in Mexico, Grand Cayman, the Bahamas, Turks and Caicos, and the British Virgin Islands. The company was founded in 1929 and is based in Raleigh, North Carolina.",United States,Advance Auto Parts Inc.,AAP,7.8,11.119348,8888054784.0,0.0399,19.230768,0.011627906976744186,1570.9302325581396,147.49,10.651096566263066,10.0,96.03023255813956
