index,symbol,sector,country,dividend_yield,forward_pe,long_business_summary,market_cap,short_name,trailing_eps,trailing_pe,position_weight,target_allocation,current_price,quantity,order_quantity,rounding_loss
3,ABBV,Healthcare,United States,0.037100002,13.819913,"AbbVie Inc. discovers, develops, manufactures, and sells pharmaceuticals in the worldwide. The company offers HUMIRA, a therapy administered as an injection for autoimmune and intestinal Behçet's diseases; SKYRIZI to treat moderate to severe plaque psoriasis in adults; RINVOQ, a JAK inhibitor for the treatment of moderate to severe active rheumatoid arthritis in adult patients; IMBRUVICA to treat adult patients with chronic lymphocytic leukemia (CLL), small lymphocytic lymphoma (SLL), and VENCLEXTA, a BCL-2 inhibitor used to treat adults with CLL or SLL; and MAVYRET to treat patients with chronic HCV genotype 1-6 infection. It also provides CREON, a pancreatic enzyme therapy for exocrine pancreatic insufficiency; Synthroid used in the treatment of hypothyroidism; Linzess/Constella to treat irritable bowel syndrome with constipation and chronic idiopathic constipation; Lupron for the palliative treatment of advanced prostate cancer, endometriosis and central precocious puberty, and patients with anemia caused by uterine fibroids; and Botox therapeutic. In addition, the company offers ORILISSA, a nonpeptide small molecule gonadotropin-releasing hormone antagonist for women with moderate to severe endometriosis pain; Duopa and Duodopa, a levodopa-carbidopa intestinal gel to treat Parkinson's disease; Lumigan/Ganfort, a bimatoprost ophthalmic solution for the reduction of elevated intraocular pressure (IOP) in patients with open angle glaucoma (OAG) or ocular hypertension; Ubrelvy to treat migraine with or without aura in adults; Alphagan/ Combigan, an alpha-adrenergic receptor agonist for the reduction of IOP in patients with OAG; and Restasis, a calcineurin inhibitor immunosuppressant to increase tear production, as well as other eye care products. AbbVie Inc. has a research collaboration with Dragonfly Therapeutics, Inc. The company was incorporated in 2012 and is headquartered in North Chicago, Illinois.",282000000000.0,AbbVie Inc.,7.5,21.282665,0.02,2100.0,146.28,14.356029532403609,14.0,52.07999999999988
297,PFE,Healthcare,United States,0.035099998,15.572784,"Pfizer Inc. discovers, develops, manufactures, markets, distributes, and sells biopharmaceutical products worldwide. It offers medicines and vaccines in various therapeutic areas, including cardiovascular metabolic and women's health under the Premarin family and Eliquis brands; biologics, small molecules, immunotherapies, and biosimilars under the Ibrance, Xtandi, Sutent, Inlyta, Retacrit, Lorbrena, and Braftovi brands; and sterile injectable and anti-infective medicines, and oral COVID-19 treatment under the Sulperazon, Medrol, Zavicefta, Zithromax, Vfend, Panzyga, and Paxlovid brands. The company also provides medicines and vaccines in various therapeutic areas, such as pneumococcal disease, meningococcal disease, tick-borne encephalitis, and COVID-19 under the Comirnaty/BNT162b2, Nimenrix, FSME/IMMUN-TicoVac, Trumenba, and the Prevnar family brands; biosimilars for chronic immune and inflammatory diseases under the Xeljanz, Enbrel, Inflectra, Eucrisa/Staquis, and Cibinqo brands; and amyloidosis, hemophilia, and endocrine diseases under the Vyndaqel/Vyndamax, BeneFIX, and Genotropin brands. In addition, the company is involved in the contract manufacturing business. It serves wholesalers, retailers, hospitals, clinics, government agencies, pharmacies, and individual provider offices, as well as disease control and prevention centers. The company has collaboration agreements with Bristol-Myers Squibb Company; Astellas Pharma US, Inc.; Myovant Sciences Ltd.; Akcea Therapeutics, Inc; Merck KGaA; Valneva SE; BioNTech SE; and Arvinas, Inc. Pfizer Inc. was founded in 1849 and is headquartered in New York, New York.",276000000000.0,"Pfizer, Inc.",1.707,28.828354,0.02,2100.0,43.79,47.95615437314456,47.0,41.87000000000014
248,MRK,Healthcare,United States,0.028199999,14.827586,"Merck & Co., Inc. operates as a healthcare company worldwide. It operates through two segments, Pharmaceutical and Animal Health. The Pharmaceutical segment offers human health pharmaceutical products in the areas of oncology, hospital acute care, immunology, neuroscience, virology, cardiovascular, and diabetes, as well as vaccine products, such as preventive pediatric, adolescent, and adult vaccines. The Animal Health segment discovers, develops, manufactures, and markets veterinary pharmaceuticals, vaccines, and health management solutions and services, as well as digitally connected identification, traceability, and monitoring products. It serves drug wholesalers and retailers, hospitals, and government agencies; managed health care providers, such as health maintenance organizations, pharmacy benefit managers, and other institutions; and physicians and physician distributors, veterinarians, and animal producers. The company has collaborations with AstraZeneca PLC; Bayer AG; Eisai Co., Ltd.; Ridgeback Biotherapeutics; and Gilead Sciences, Inc. to jointly develop and commercialize long-acting treatments in HIV. Merck & Co., Inc. was founded in 1891 and is headquartered in Kenilworth, New Jersey.",272000000000.0,"Merck & Company, Inc.",2.769,38.822678,0.02,2100.0,105.38,19.927880053141013,19.0,97.77999999999999
299,AVGO,Technology,United States,0.0356,18.266459,"Broadcom Inc. designs, develops, and supplies various semiconductor devices with a focus on complex digital and mixed signal complementary metal oxide semiconductor based devices and analog III-V based products worldwide. The company operates in two segments, Semiconductor Solutions and Infrastructure Software. It provides set-top box system-on-chips (SoCs); cable, digital subscriber line, and passive optical networking central office/consumer premise equipment SoCs; wireless local area network access point SoCs; Ethernet switching and routing merchant silicon products; embedded processors and controllers; serializer/deserializer application specific integrated circuits; optical and copper, and physical layers; and fiber optic transmitter and receiver components. The company also offers RF front end modules, filters, and power amplifiers; Wi-Fi, Bluetooth, and global positioning system/global navigation satellite system SoCs; custom touch controllers; serial attached small computer system interface, and redundant array of independent disks controllers and adapters; peripheral component interconnect express switches; fiber channel host bus adapters; read channel based SoCs; custom flash controllers; preamplifiers; and optocouplers, industrial fiber optics, and motion control encoders and subsystems. Its products are used in various applications, including enterprise and data center networking, home connectivity, set-top boxes, broadband access, telecommunication equipment, smartphones and base stations, data center servers and storage systems, factory automation, power generation and alternative energy systems, and electronic displays. Broadcom Inc. was incorporated in 2018 and is headquartered in San Jose, California.",219000000000.0,Broadcom Inc.,8.647,61.28252,0.02,2100.0,590.99,3.553359616913992,3.0,327.03000000000003
287,CSCO,Technology,United States,0.0342,14.152047,"Cisco Systems, Inc. designs, manufactures, and sells Internet Protocol based networking and other products related to the communications and information technology industry in the Americas, Europe, the Middle East, Africa, the Asia Pacific, Japan, and China. The company also offers switching portfolio encompasses campus switching as well as data center switching; enterprise routing portfolio interconnects public and private wireline and mobile networks, delivering highly secure, and reliable connectivity to campus, data center and branch networks; wireless products include wireless access points that are standalone, controller appliance-based, switch-converged, and Meraki cloud-managed offerings; and compute portfolio including the cisco unified computing system, hyperflex, and software management capabilities, which combine computing, networking, and storage infrastructure management and virtualization. In addition, it provides Internet for the future product consists of routed optical networking, 5G, silicon, and optics solutions; collaboration products, such as meetings, collaboration devices, calling, contact center, and communication platform as a service; end-to-end security product consists of network security, cloud security, security endpoints, unified threat management, and zero trust; and optimized application experiences products including full stack observability and cloud-native platform. Further, the company offers a range of service and support options for its customers, including technical support and advanced services and advisory services. It serves businesses of various sizes, public institutions, governments, and service providers. The company sells its products and services directly, as well as through systems integrators, service providers, other resellers, and distributors. Cisco Systems, Inc. has strategic alliances with other companies. Cisco Systems, Inc. was incorporated in 1984 and is headquartered in San Jose, California.",204000000000.0,"Cisco Systems, Inc.",2.39,20.251045,0.02,2100.0,48.51,43.29004329004329,43.0,14.070000000000153
252,BMY,Healthcare,United States,0.029000001,9.942284,"Bristol-Myers Squibb Company discovers, develops, licenses, manufactures, and markets biopharmaceutical products worldwide. It offers products for hematology, oncology, cardiovascular, immunology, fibrotic, neuroscience, and covid-19 diseases. The company's products include Revlimid, an oral immunomodulatory drug for the treatment of multiple myeloma; Eliquis, an oral inhibitor for reduction in risk of stroke/systemic embolism in NVAF, and for the treatment of DVT/PE; Opdivo for anti-cancer indications; Pomalyst/Imnovid indicated for patients with multiple myeloma; and Orencia for adult patients with active RA and psoriatic arthritis. It also provides Sprycel for the treatment of Philadelphia chromosome-positive chronic myeloid leukemia; Yervoy for the treatment of patients with unresectable or metastatic melanoma; Abraxane, a protein-bound chemotherapy product; Reblozyl for the treatment of anemia in adult patients with beta thalassemia; and Empliciti for the treatment of multiple myeloma. In addition, the company offers Zeposia to treat relapsing forms of multiple sclerosis; Breyanzi, a CD19-directed genetically modified autologous T cell immunotherapy for the treatment of adult patients with relapsed or refractory large B-cell lymphoma; Inrebic, an oral kinase inhibitor indicated for the treatment of adult patients with myelofibrosis; and Onureg for the treatment of adult patients with AML. It sells products to wholesalers, distributors, pharmacies, retailers, hospitals, clinics, and government agencies. The company was formerly known as Bristol-Myers Company. The company was founded in 1887 and is headquartered in New York, New York.",176000000000.0,Bristol-Myers Squibb Company,-2.764,0.0,0.02,2100.0,72.45,28.98550724637681,28.0,71.3999999999998
268,TXN,Technology,United States,0.031400003,22.585459,"Texas Instruments Incorporated designs, manufactures, and sells semiconductors to electronics designers and manufacturers worldwide. It operates in two segments, Analog and Embedded Processing. The Analog segment offers power products to manage power requirements in various levels using battery-management solutions, DC/DC switching regulators, AC/DC and isolated controllers and converters, power switches, linear regulators, voltage supervisors, voltage references, and lighting products. This segment also provides signal chain products that sense, condition, and measure signals to allow information to be transferred or converted for further processing and control for use in end markets, including amplifiers, data converters, interface products, motor drives, clocks, and sensing products. The Embedded Processing segment offers microcontrollers that are used in electronic equipment; digital signal processors for mathematical computations; and applications processors for specific computing activity. This segment offers products for use in various markets, such as industrial, automotive, personal electronics, communications equipment, enterprise systems, and calculators and other. The company also provides DLP products primarily for use in projectors to create high-definition images; calculators; and application-specific integrated circuits. It markets and sells its semiconductor products through direct sales and distributors, as well as through its website. Texas Instruments Incorporated was founded in 1930 and is headquartered in Dallas, Texas.",164000000000.0,Texas Instruments Incorporated,6.603,26.816599,0.02,2100.0,175.24,11.983565396028304,11.0,172.35999999999999
381,VZ,Communication Services,United States,0.0721,7.5473886,"Verizon Communications Inc., through its subsidiaries, offers communications, technology, information, and entertainment products and services to consumers, businesses, and governmental entities worldwide. Its Consumer segment provides postpaid and prepaid service plans; internet access on notebook computers and tablets; wireless equipment, including smartphones and other handsets; and wireless-enabled internet devices, such as tablets, and other wireless-enabled connected devices comprising smart watches. It also provides residential fixed connectivity solutions, such as internet, video, and voice services; and sells network access to mobile virtual network operators. As of December 31, 2021, it had approximately 115 million wireless retail connections, 7 million wireline broadband connections, and 4 million Fios video connections. The company's Business segment provides network connectivity products, including private networking, private cloud connectivity, virtual and software defined networking, and internet access services; and internet protocol-based voice and video services, unified communications and collaboration tools, and customer contact center solutions. This segment also offers a suite of management and data security services; domestic and global voice and data solutions, such as voice calling, messaging services, conferencing, contact center solutions, and private line and data access networks; customer premises equipment; installation, maintenance, and site services; and Internet of Things products and services. As of December 31, 2021, it had approximately 27 million wireless retail postpaid connections and 477 thousand wireline broadband connections. The company was formerly known as Bell Atlantic Corporation and changed its name to Verizon Communications Inc. in June 2000. Verizon Communications Inc. was incorporated in 1983 and is headquartered in New York, New York.",164000000000.0,Verizon Communications Inc.,4.562,8.553267,0.02,2100.0,40.64,51.67322834645669,51.0,27.359999999999843
301,UPS,Industrials,United States,0.036,16.081057,"United Parcel Service, Inc. provides letter and package delivery, transportation, logistics, and related services. It operates through two segments, U.S. Domestic Package and International Package. The U.S. Domestic Package segment offers time-definite delivery of letters, documents, small packages, and palletized freight through air and ground services in the United States. The International Package segment provides guaranteed day and time-definite international shipping services in Europe, the Asia Pacific, Canada and Latin America, the Indian sub-continent, the Middle East, and Africa. This segment offers guaranteed time-definite express options. The company also provides international air and ocean freight forwarding, customs brokerage, distribution and post-sales, and mail and consulting services in approximately 200 countries and territories. In addition, it offers truckload brokerage services; supply chain solutions to the healthcare and life sciences industry; shipping, visibility, and billing technologies; and financial and insurance services. The company operates a fleet of approximately 121,000 package cars, vans, tractors, and motorcycles; and owns 59,000 containers that are used to transport cargo in its aircraft. United Parcel Service, Inc. was founded in 1907 and is headquartered in Atlanta, Georgia.",159000000000.0,"United Parcel Service, Inc.",5.922,30.82067,0.02,2100.0,182.09,11.532758526003624,11.0,97.0099999999999
372,PM,Consumer Defensive,United States,0.0574,14.774436,"Philip Morris International Inc. operates as a tobacco company working to delivers a smoke-free future and evolving portfolio for the long-term to include products outside of the tobacco and nicotine sector. The company's product portfolio primarily consists of cigarettes and smoke-free products, including heat-not-burn, vapor, and oral nicotine products that are sold in markets outside the United States. The company offers its smoke-free products under the HEETS, HEETS Creations, HEETS Dimensions, HEETS Marlboro, HEETS FROM MARLBORO, Marlboro Dimensions, Marlboro HeatSticks, Parliament HeatSticks, and TEREA brands, as well as the KT&G-licensed brands, Fiit, and Miix. It also sells its products under the Marlboro, Parliament, Bond Street, Chesterfield, L&M, Lark, and Philip Morris brands. In addition, the company owns various cigarette brands, such as Dji Sam Soe, Sampoerna A, and Sampoerna U in Indonesia; and Fortune and Jackpot in the Philippines. The company sells its smoke-free products in 71 markets. Philip Morris International Inc. was incorporated in 1987 and is headquartered in New York, New York.",153000000000.0,Philip Morris International Inc,5.539,17.737858,0.02,2100.0,103.76,20.239013107170393,20.0,24.80000000000002
234,UNP,Industrials,United States,0.026600001,19.716267,"Union Pacific Corporation, through its subsidiary, Union Pacific Railroad Company, operates in the railroad business in the United States. The company offers transportation services for grain and grain products, fertilizers, food and refrigerated products, and coal and renewables to grain processors, animal feeders, ethanol producers, and other agricultural users; petroleum, and liquid petroleum gases; and construction products, industrial chemicals, plastics, forest products, specialized products, metals and ores, soda ash, and sand, as well as finished automobiles, automotive parts, and merchandise in intermodal containers. As of December 31, 2021, its rail network included 32,452 route miles connecting Pacific Coast and Gulf Coast ports with the Midwest and Eastern United States gateways. The company was founded in 1862 and is headquartered in Omaha, Nebraska.",137000000000.0,Union Pacific Corporation,7.727,27.608385,0.02,2100.0,202.39,10.37600671969959,10.0,76.1000000000002
374,T,Communication Services,United States,0.0581,7.439689,"AT&T Inc. provides telecommunications, media, and technology services worldwide. Its Communications segment offers wireless voice and data communications services; and sells handsets, wireless data cards, wireless computing devices, and carrying cases and hands-free devices through its own company-owned stores, agents, and third-party retail stores. It also provides data, voice, security, cloud solutions, outsourcing, and managed and professional services, as well as customer premises equipment for multinational corporations, small and mid-sized businesses, governmental, and wholesale customers. In addition, this segment offers broadband fiber and legacy telephony voice communication services to residential customers. It markets its communications services and products under the AT&T, Cricket, AT&T PREPAID, and AT&T Fiber brand names. The company's Latin America segment provides wireless services in Mexico; and video services in Latin America. This segment markets its services and products under the AT&T and Unefon brand names. The company was formerly known as SBC Communications Inc. and changed its name to AT&T Inc. in 2005. AT&T Inc. was incorporated in 1983 and is headquartered in Dallas, Texas.",136000000000.0,AT&T Inc.,2.42,7.9008265,0.02,2100.0,19.95,105.26315789473685,105.0,5.250000000000149
224,LMT,Industrials,United States,0.025899999,17.328316,"Lockheed Martin Corporation, a security and aerospace company, engages in the research, design, development, manufacture, integration, and sustainment of technology systems, products, and services worldwide. It operates through four segments: Aeronautics, Missiles and Fire Control, Rotary and Mission Systems, and Space. The Aeronautics segment offers combat and air mobility aircraft, unmanned air vehicles, and related technologies. The Missiles and Fire Control segment provides air and missile defense systems; tactical missiles and air-to-ground precision strike weapon systems; logistics; fire control systems; mission operations support, readiness, engineering support, and integration services; manned and unmanned ground vehicles; and energy management solutions. The Rotary and Mission Systems segment offers military and commercial helicopters, surface ships, sea and land-based missile defense systems, radar systems, sea and air-based mission and combat systems, command and control mission solutions, cyber solutions, and simulation and training solutions. The Space segment offers satellites; space transportation systems; strategic, advanced strike, and defensive missile systems; and classified systems and services in support of national security systems. This segment also provides network-enabled situational awareness and integrates space and ground-based systems to help its customers gather, analyze, and securely distribute critical intelligence data. It serves primarily serves the U.S. government, as well as foreign military sales contracted through the U.S. government. Lockheed Martin Corporation was founded in 1912 and is headquartered in Bethesda, Maryland.",133000000000.0,Lockheed Martin Corporation,24.783,19.507727,0.02,2100.0,459.6,4.569190600522193,4.0,261.5999999999998
353,IBM,Technology,United States,0.048899997,12.312862,"International Business Machines Corporation provides integrated solutions and services worldwide. The company operates through four business segments: Software, Consulting, Infrastructure, and Financing. The Software segment offers hybrid cloud platform and software solutions, such as Red Hat, an enterprise open-source solutions; software for business automation, AIOps and management, integration, and application servers; data and artificial intelligence solutions; and security software and services for threat, data, and identity. This segment also provides transaction processing software that supports clients' mission-critical and on-premise workloads in banking, airlines, and retail industries. The Consulting segment offers business transformation services, including strategy, business process design and operations, data and analytics, and system integration services; technology consulting services; and application and cloud platform services. The Infrastructure segment provides on-premises and cloud-based server and storage solutions for its clients' mission-critical and regulated workloads; and support services and solutions for hybrid cloud infrastructure, as well as remanufacturing and remarketing services for used equipment. The Financing segment offers lease, installment payment, loan financing, and short-term working capital financing services. The company was formerly known as Computing-Tabulating-Recording Co. International Business Machines Corporation was incorporated in 1911 and is headquartered in Armonk, New York.",133000000000.0,International Business Machines,5.978,24.819336,0.02,2100.0,134.39,15.626162660912271,15.0,84.15000000000015
367,INTC,Technology,United States,0.0533,6.3921566,"Intel Corporation engages in the design, manufacture, and sale of computer products and technologies worldwide. The company operates through CCG, DCG, IOTG, Mobileye, NSG, PSG, and All Other segments. It offers platform products, such as central processing units and chipsets, and system-on-chip and multichip packages; and non-platform or adjacent products, including accelerators, boards and systems, connectivity products, graphics, and memory and storage products. The company also provides high-performance compute solutions for targeted verticals and embedded applications for retail, industrial, and healthcare markets; and solutions for assisted and autonomous driving comprising compute platforms, computer vision and machine learning-based sensing, mapping and localization, driving policy, and active sensors. In addition, it offers workload-optimized platforms and related products for cloud service providers, enterprise and government, and communications service providers. The company serves original equipment manufacturers, original design manufacturers, and cloud service providers. Intel Corporation has a strategic partnership with MILA to develop and apply advances in artificial intelligence methods for enhancing the search in the space of drugs. The company was incorporated in 1968 and is headquartered in Santa Clara, California.",119000000000.0,Intel Corporation,4.456,6.5843806,0.02,2100.0,28.16,74.57386363636364,74.0,16.16000000000011
